,comment,currency,amount,text_length,text_wordcount,tokenized_comment
251,"Being retrench recently, I am aware on the fear of the unknown esp that Malaysia is still facing extended lock down... Thus, Sending love from SG & May we trust that He is  Jehovah Rapha & our provider <3",MYR,40000,204.0,40.0,"['being', 'retrench', 'recently', 'i', 'am', 'aware', 'on', 'the', 'fear', 'of', 'the', 'unknown', 'esp', 'that', 'malaysia', 'is', 'still', 'facing', 'extended', 'lock', 'down', 'thus', 'sending', 'love', 'from', 'sg', 'may', 'we', 'trust', 'that', 'he', 'is', 'jehovah', 'rapha', 'our', 'provider']"
252,Charity begins with you,MYR,20000,23.0,4.0,"['charity', 'begins', 'with', 'you']"
253,"I donated because my mom has a same situation many years back, she has insurance to support her the entire ops. Please help Auntie. I know Gleneagles Dr Ngoi. He is the surgeon whom help my mom recovered from colon cancer",SGD,10000,221.0,41.0,"['i', 'donated', 'because', 'my', 'mom', 'has', 'a', 'same', 'situation', 'many', 'years', 'back', 'she', 'has', 'insurance', 'to', 'support', 'her', 'the', 'entire', 'ops', 'please', 'help', 'auntie', 'i', 'know', 'gleneagles', 'dr', 'ngoi', 'he', 'is', 'the', 'surgeon', 'whom', 'help', 'my', 'mom', 'recovered', 'from', 'colon', 'cancer']"
254,"nobody wants to be in this situation. we help while we can.
when someone ask for help in finances, it is more than an ask, because he/she has put down everything to ask. 
let us all try to help :)",SGD,5000,196.0,39.0,"['nobody', 'wants', 'to', 'be', 'in', 'this', 'situation', 'we', 'help', 'while', 'we', 'can', 'when', 'someone', 'ask', 'for', 'help', 'in', 'finances', 'it', 'is', 'more', 'than', 'an', 'ask', 'because', 'he', 'she', 'has', 'put', 'down', 'everything', 'to', 'ask', 'let', 'us', 'all', 'try', 'to', 'help']"
255,Jiayou!hope u recover soon!,SGD,1000,27.0,4.0,"['jiayou', 'hope', 'u', 'recover', 'soon']"
256,I donated in honor of NCT Mark Lee's birthday ♡ Mark is also a Christian and I wanted to celebrate his birthday by helping out others in God's kingdom :)),USD,2300,154.0,30.0,"['i', 'donated', 'in', 'honor', 'of', 'nct', 'mark', 'lee', 's', 'birthday', 'mark', 'is', 'also', 'a', 'christian', 'and', 'i', 'wanted', 'to', 'celebrate', 'his', 'birthday', 'by', 'helping', 'out', 'others', 'in', 'god', 's', 'kingdom']"
257,"I feel so much for the situation that’s happening in India from news articles, friends and videos being shared. It’s horrible and I would never want that situation to happen to anyone ever. 

As fellow humans, we need to help each other",SGD,10000,236.0,42.0,"['i', 'feel', 'so', 'much', 'for', 'the', 'situation', 'that', 's', 'happening', 'in', 'india', 'from', 'news', 'articles', 'friends', 'and', 'videos', 'being', 'shared', 'it', 's', 'horrible', 'and', 'i', 'would', 'never', 'want', 'that', 'situation', 'to', 'happen', 'to', 'anyone', 'ever', 'as', 'fellow', 'humans', 'we', 'need', 'to', 'help', 'each', 'other']"
258,we have to treat it as family on the earth.,INR,50000,43.0,10.0,"['we', 'have', 'to', 'treat', 'it', 'as', 'family', 'on', 'the', 'earth']"
260,"I donated because he deserves to see the world and grow. As a kid, he deserve to have a wonderful childhood to remember. But with his strength and bravery, I want to believe he can pull through. Keeping you in my prayers.",SGD,5000,221.0,42.0,"['i', 'donated', 'because', 'he', 'deserves', 'to', 'see', 'the', 'world', 'and', 'grow', 'as', 'a', 'kid', 'he', 'deserve', 'to', 'have', 'a', 'wonderful', 'childhood', 'to', 'remember', 'but', 'with', 'his', 'strength', 'and', 'bravery', 'i', 'want', 'to', 'believe', 'he', 'can', 'pull', 'through', 'keeping', 'you', 'in', 'my', 'prayers']"
261,It is the right thing to do…,SGD,5000,28.0,7.0,"['it', 'is', 'the', 'right', 'thing', 'to', 'do']"
262,I donated because I know her since high school and I am ofw as well. I hope this small amount can help here medical needs,SGD,5000,121.0,25.0,"['i', 'donated', 'because', 'i', 'know', 'her', 'since', 'high', 'school', 'and', 'i', 'am', 'ofw', 'as', 'well', 'i', 'hope', 'this', 'small', 'amount', 'can', 'help', 'here', 'medical', 'needs']"
263,In remembrance of Ying and support of CEP,SGD,10000,41.0,8.0,"['in', 'remembrance', 'of', 'ying', 'and', 'support', 'of', 'cep']"
264,"TBSS has a sister company in Vietnam, Cong Ty TNHH Cong Nghe va giam Sat Radar TBSS.  Our director who stations in HCMC has been there for years, he is now fighting with the people against the pandemic.",VND,5000000,202.0,39.0,"['tbss', 'has', 'a', 'sister', 'company', 'in', 'vietnam', 'cong', 'ty', 'tnhh', 'cong', 'nghe', 'va', 'giam', 'sat', 'radar', 'tbss', 'our', 'director', 'who', 'stations', 'in', 'hcmc', 'has', 'been', 'there', 'for', 'years', 'he', 'is', 'now', 'fighting', 'with', 'the', 'people', 'against', 'the', 'pandemic']"
265,I received it from my friend..,SGD,5000,30.0,6.0,"['i', 'received', 'it', 'from', 'my', 'friend']"
266,Small amount but we hope it helpa,SGD,2000,33.0,7.0,"['small', 'amount', 'but', 'we', 'hope', 'it', 'helpa']"
267,"To kids family members, remember to take care of yourselves in order to show up better for you and your kid. Have faith and stay strong 💪 you can do this!",SGD,5000,154.0,31.0,"['to', 'kids', 'family', 'members', 'remember', 'to', 'take', 'care', 'of', 'yourselves', 'in', 'order', 'to', 'show', 'up', 'better', 'for', 'you', 'and', 'your', 'kid', 'have', 'faith', 'and', 'stay', 'strong', 'you', 'can', 'do', 'this']"
268,I donated because Jocelin’s so young and deserved to recover and to continue her life in this world. Similar transplant was advised to my dad and totally understood the pain to be endured by the kid. Please support her!,MYR,40000,219.0,39.0,"['i', 'donated', 'because', 'jocelin', 's', 'so', 'young', 'and', 'deserved', 'to', 'recover', 'and', 'to', 'continue', 'her', 'life', 'in', 'this', 'world', 'similar', 'transplant', 'was', 'advised', 'to', 'my', 'dad', 'and', 'totally', 'understood', 'the', 'pain', 'to', 'be', 'endured', 'by', 'the', 'kid', 'please', 'support', 'her']"
269,"Although a small amount. I hope he is able to recover with a peace of mind, without worrying about the finances.",SGD,1000,112.0,21.0,"['although', 'a', 'small', 'amount', 'i', 'hope', 'he', 'is', 'able', 'to', 'recover', 'with', 'a', 'peace', 'of', 'mind', 'without', 'worrying', 'about', 'the', 'finances']"
270,We care…,SGD,100000,8.0,2.0,"['we', 'care']"
271,Jiayou!Theres lots of love in this world,SGD,2000,40.0,7.0,"['jiayou', 'theres', 'lots', 'of', 'love', 'in', 'this', 'world']"
272,All is well,SGD,5000,11.0,3.0,"['all', 'is', 'well']"
273,If I draw near to God and the love of Jesus. Jesus will set us free,SGD,500,67.0,16.0,"['if', 'i', 'draw', 'near', 'to', 'god', 'and', 'the', 'love', 'of', 'jesus', 'jesus', 'will', 'set', 'us', 'free']"
274,I'm also a chef. 加油,SGD,5000,19.0,5.0,"['i', 'm', 'also', 'a', 'chef']"
275,a few more donations before we reach our target goal of $5000!!!,SGD,2000,64.0,12.0,"['a', 'few', 'more', 'donations', 'before', 'we', 'reach', 'our', 'target', 'goal', 'of']"
276,Just to help the less fortunate one,MYR,20000,35.0,7.0,"['just', 'to', 'help', 'the', 'less', 'fortunate', 'one']"
277,"He deserve a healthy child life, If my small contribution can help him to get it back then I consider myself a lucky person,
All, I urge you to please do your share, there is no language, religion or country more than the humanity.",SGD,20100,231.0,43.0,"['he', 'deserve', 'a', 'healthy', 'child', 'life', 'if', 'my', 'small', 'contribution', 'can', 'help', 'him', 'to', 'get', 'it', 'back', 'then', 'i', 'consider', 'myself', 'a', 'lucky', 'person', 'all', 'i', 'urge', 'you', 'to', 'please', 'do', 'your', 'share', 'there', 'is', 'no', 'language', 'religion', 'or', 'country', 'more', 'than', 'the', 'humanity']"
278,To help a fellow Christian in need.,SGD,10000,35.0,7.0,"['to', 'help', 'a', 'fellow', 'christian', 'in', 'need']"
279,I may not know you personally but I pray for your continuous healing. Praying also for strength and hope for the entire family. May we continue to strengthen our faith to the Lord during this difficult time. Offer it all to Him!God bless🙏,SGD,5000,238.0,43.0,"['i', 'may', 'not', 'know', 'you', 'personally', 'but', 'i', 'pray', 'for', 'your', 'continuous', 'healing', 'praying', 'also', 'for', 'strength', 'and', 'hope', 'for', 'the', 'entire', 'family', 'may', 'we', 'continue', 'to', 'strengthen', 'our', 'faith', 'to', 'the', 'lord', 'during', 'this', 'difficult', 'time', 'offer', 'it', 'all', 'to', 'him', 'god', 'bless']"
280,Helping others is the source of happiness,SGD,3000,41.0,7.0,"['helping', 'others', 'is', 'the', 'source', 'of', 'happiness']"
281,All the best,SGD,3000,12.0,3.0,"['all', 'the', 'best']"
282,I hope he can recover and reunite with his family in Malaysia.,SGD,5000,62.0,12.0,"['i', 'hope', 'he', 'can', 'recover', 'and', 'reunite', 'with', 'his', 'family', 'in', 'malaysia']"
283,We need to help each other,SGD,2000,26.0,6.0,"['we', 'need', 'to', 'help', 'each', 'other']"
285,Wishing the boy and his family all the happiness in the world.,SGD,5000,62.0,12.0,"['wishing', 'the', 'boy', 'and', 'his', 'family', 'all', 'the', 'happiness', 'in', 'the', 'world']"
286,Pay it forward,SGD,3000,14.0,3.0,"['pay', 'it', 'forward']"
287,"Helping fellow Malaysians stuck in singapore during this pandemic, unable to see his family",SGD,1000,91.0,14.0,"['helping', 'fellow', 'malaysians', 'stuck', 'in', 'singapore', 'during', 'this', 'pandemic', 'unable', 'to', 'see', 'his', 'family']"
288,I donated because someone needs my help and every cent no matter how big or small can help a person in need.,SGD,1000,108.0,22.0,"['i', 'donated', 'because', 'someone', 'needs', 'my', 'help', 'and', 'every', 'cent', 'no', 'matter', 'how', 'big', 'or', 'small', 'can', 'help', 'a', 'person', 'in', 'need']"
291,I love cats,SGD,5000,11.0,3.0,"['i', 'love', 'cats']"
292,I donated because i know how hard Kelly is going through right now. A small donation if there will be lots of people will do this can be of great help to the family. May she be healed completely.,MYR,20000,195.0,39.0,"['i', 'donated', 'because', 'i', 'know', 'how', 'hard', 'kelly', 'is', 'going', 'through', 'right', 'now', 'a', 'small', 'donation', 'if', 'there', 'will', 'be', 'lots', 'of', 'people', 'will', 'do', 'this', 'can', 'be', 'of', 'great', 'help', 'to', 'the', 'family', 'may', 'she', 'be', 'healed', 'completely']"
293,It’s a good cause and I’m touched by the children’s efforts,SGD,10000,59.0,11.0,"['it', 's', 'a', 'good', 'cause', 'and', 'i', 'm', 'touched', 'by', 'the', 'children', 's', 'efforts']"
294,"It’s happy to hlp someone in needs,😘",SGD,5000,36.0,7.0,"['it', 's', 'happy', 'to', 'hlp', 'someone', 'in', 'needs']"
295,Speedy recovery,MYR,20000,15.0,2.0,"['speedy', 'recovery']"
297,Not easy to ppl who who overseas. Hope he will get will soon 🙏,SGD,3000,62.0,14.0,"['not', 'easy', 'to', 'ppl', 'who', 'who', 'overseas', 'hope', 'he', 'will', 'get', 'will', 'soon']"
298,God bless us baby….. pray for your speedy recovery,SGD,5000,50.0,9.0,"['god', 'bless', 'us', 'baby', 'pray', 'for', 'your', 'speedy', 'recovery']"
299,I donated because i have kids myself and i hope that they will grow up to be healthy and happy,SGD,5000,94.0,20.0,"['i', 'donated', 'because', 'i', 'have', 'kids', 'myself', 'and', 'i', 'hope', 'that', 'they', 'will', 'grow', 'up', 'to', 'be', 'healthy', 'and', 'happy']"
300,"I donate because I would like to contribute a little bit my effort to everyone , help them have a better life.",VND,500000,110.0,22.0,"['i', 'donate', 'because', 'i', 'would', 'like', 'to', 'contribute', 'a', 'little', 'bit', 'my', 'effort', 'to', 'everyone', 'help', 'them', 'have', 'a', 'better', 'life']"
301,I hope she gets well soon without worrying about her medical expense.,SGD,5000,69.0,12.0,"['i', 'hope', 'she', 'gets', 'well', 'soon', 'without', 'worrying', 'about', 'her', 'medical', 'expense']"
303,Don’t give up and keep fighting. Be strong the parents.,MYR,13000,55.0,10.0,"['don', 't', 'give', 'up', 'and', 'keep', 'fighting', 'be', 'strong', 'the', 'parents']"
304,i want her to be able to recover and go back home to see her grandchildren again,SGD,10000,80.0,17.0,"['i', 'want', 'her', 'to', 'be', 'able', 'to', 'recover', 'and', 'go', 'back', 'home', 'to', 'see', 'her', 'grandchildren', 'again']"
305,Just want to help those in need.,MYR,13000,32.0,7.0,"['just', 'want', 'to', 'help', 'those', 'in', 'need']"
306,Hope recover soon!!,SGD,5000,19.0,3.0,"['hope', 'recover', 'soon']"
307,I donated on humanitarian ground. It's very difficult to raise 7 children.  If they are adults then they can work n help out. All the best to her.,SGD,5000,146.0,29.0,"['i', 'donated', 'on', 'humanitarian', 'ground', 'it', 's', 'very', 'difficult', 'to', 'raise', 'children', 'if', 'they', 'are', 'adults', 'then', 'they', 'can', 'work', 'n', 'help', 'out', 'all', 'the', 'best', 'to', 'her']"
308,This was my first ever paycheck and I wanted to donate a part of it to a cause that is very near and dear to my heart :),MYR,10000,120.0,28.0,"['this', 'was', 'my', 'first', 'ever', 'paycheck', 'and', 'i', 'wanted', 'to', 'donate', 'a', 'part', 'of', 'it', 'to', 'a', 'cause', 'that', 'is', 'very', 'near', 'and', 'dear', 'to', 'my', 'heart']"
310,Reminded me of my late son.,SGD,1000,27.0,6.0,"['reminded', 'me', 'of', 'my', 'late', 'son']"
311,May the Merciful Buddha keep u blessed n protected from all harm 🙏Om Mani Padme Hum🙏 早日康复,SGD,5000,89.0,17.0,"['may', 'the', 'merciful', 'buddha', 'keep', 'u', 'blessed', 'n', 'protected', 'from', 'all', 'harm', 'om', 'mani', 'padme', 'hum']"
312,It is good,USD,500,10.0,3.0,"['it', 'is', 'good']"
315,To support the donation.,SGD,1000,24.0,4.0,"['to', 'support', 'the', 'donation']"
316,“He heals the brokenhearted and binds up their wounds.” — Psalm 147:3,SGD,30000,69.0,12.0,"['he', 'heals', 'the', 'brokenhearted', 'and', 'binds', 'up', 'their', 'wounds', 'psalm']"
318,Wish and blessings to recover quickly. Wish healthy and long life,SGD,5100,65.0,11.0,"['wish', 'and', 'blessings', 'to', 'recover', 'quickly', 'wish', 'healthy', 'and', 'long', 'life']"
320,A bit of contribution from everyone can give people in need hope to live on. It’s worth it.,SGD,2000,91.0,18.0,"['a', 'bit', 'of', 'contribution', 'from', 'everyone', 'can', 'give', 'people', 'in', 'need', 'hope', 'to', 'live', 'on', 'it', 's', 'worth', 'it']"
321,I donated because I'm a healthcare professional (been a nurse for the last 30yrs) and I understand how important it is for everyone to have good mental health,SGD,10000,158.0,28.0,"['i', 'donated', 'because', 'i', 'm', 'a', 'healthcare', 'professional', 'been', 'a', 'nurse', 'for', 'the', 'last', 'yrs', 'and', 'i', 'understand', 'how', 'important', 'it', 'is', 'for', 'everyone', 'to', 'have', 'good', 'mental', 'health']"
322,"We donated because we need to help each other in times of need. We help because if we were in a disadvantaged position ourselves, we would want to be helped.",SGD,26000,157.0,30.0,"['we', 'donated', 'because', 'we', 'need', 'to', 'help', 'each', 'other', 'in', 'times', 'of', 'need', 'we', 'help', 'because', 'if', 'we', 'were', 'in', 'a', 'disadvantaged', 'position', 'ourselves', 'we', 'would', 'want', 'to', 'be', 'helped']"
324,"""As one person I cannot change the world, 
But I hope I can change the world of one person.""",SGD,5000,92.0,19.0,"['as', 'one', 'person', 'i', 'cannot', 'change', 'the', 'world', 'but', 'i', 'hope', 'i', 'can', 'change', 'the', 'world', 'of', 'one', 'person']"
325,"Get well soon, 
Myanmar.",SGD,1000,24.0,4.0,"['get', 'well', 'soon', 'myanmar']"
326,Would like to give people in need hope for better life.,SGD,3000,55.0,11.0,"['would', 'like', 'to', 'give', 'people', 'in', 'need', 'hope', 'for', 'better', 'life']"
327,Hope baby can alive a new life,SGD,2000,30.0,7.0,"['hope', 'baby', 'can', 'alive', 'a', 'new', 'life']"
328,I willing to help people especially Burmese.,SGD,3000,44.0,7.0,"['i', 'willing', 'to', 'help', 'people', 'especially', 'burmese']"
329,"I donated because I am a cancer survivor, and I can truly understand how much pain it is to go through it. Keep fighting, Miguel!",SGD,3000,129.0,25.0,"['i', 'donated', 'because', 'i', 'am', 'a', 'cancer', 'survivor', 'and', 'i', 'can', 'truly', 'understand', 'how', 'much', 'pain', 'it', 'is', 'to', 'go', 'through', 'it', 'keep', 'fighting', 'miguel']"
330,My cousin had leukemia and he passed on at the age of thirteen. At that time i was a secondary school student and I didn’t know how to help him. At least now im happy that i can help with my contribution. Praying for his speedy recovery.,SGD,5000,237.0,47.0,"['my', 'cousin', 'had', 'leukemia', 'and', 'he', 'passed', 'on', 'at', 'the', 'age', 'of', 'thirteen', 'at', 'that', 'time', 'i', 'was', 'a', 'secondary', 'school', 'student', 'and', 'i', 'didn', 't', 'know', 'how', 'to', 'help', 'him', 'at', 'least', 'now', 'im', 'happy', 'that', 'i', 'can', 'help', 'with', 'my', 'contribution', 'praying', 'for', 'his', 'speedy', 'recovery']"
331,All the best for all the good work.,MYR,20000,35.0,8.0,"['all', 'the', 'best', 'for', 'all', 'the', 'good', 'work']"
332,I hope Mila can receive the medical treatment she needs.,SGD,200,56.0,10.0,"['i', 'hope', 'mila', 'can', 'receive', 'the', 'medical', 'treatment', 'she', 'needs']"
333,Every child deserves to live. The Almighty has gave us this opportunity to help. May Manidhar have a complete recovery.,SGD,3000,119.0,20.0,"['every', 'child', 'deserves', 'to', 'live', 'the', 'almighty', 'has', 'gave', 'us', 'this', 'opportunity', 'to', 'help', 'may', 'manidhar', 'have', 'a', 'complete', 'recovery']"
334,Can help people who really need care and love. Hope all people include my family health and happy always. From George Oo Hong Yi,SGD,1000,128.0,24.0,"['can', 'help', 'people', 'who', 'really', 'need', 'care', 'and', 'love', 'hope', 'all', 'people', 'include', 'my', 'family', 'health', 'and', 'happy', 'always', 'from', 'george', 'oo', 'hong', 'yi']"
335,I want to help others who are in need to share the love of Jesus,SGD,10000,64.0,15.0,"['i', 'want', 'to', 'help', 'others', 'who', 'are', 'in', 'need', 'to', 'share', 'the', 'love', 'of', 'jesus']"
337,I helped because I went through before during my young adult days and I totally understand how it is like. I have received help and my life is never the same as before.,SGD,50000,168.0,33.0,"['i', 'helped', 'because', 'i', 'went', 'through', 'before', 'during', 'my', 'young', 'adult', 'days', 'and', 'i', 'totally', 'understand', 'how', 'it', 'is', 'like', 'i', 'have', 'received', 'help', 'and', 'my', 'life', 'is', 'never', 'the', 'same', 'as', 'before']"
339,Its my duty to help fellow muslim..and I pray that she will be go thru this with Allah help and blessing....,SGD,5000,108.0,21.0,"['its', 'my', 'duty', 'to', 'help', 'fellow', 'muslim', 'and', 'i', 'pray', 'that', 'she', 'will', 'be', 'go', 'thru', 'this', 'with', 'allah', 'help', 'and', 'blessing']"
340,My prayers be with you kid. May Allah help you heal fast.,SGD,5000,57.0,12.0,"['my', 'prayers', 'be', 'with', 'you', 'kid', 'may', 'allah', 'help', 'you', 'heal', 'fast']"
341,Get well soon to him,SGD,500,20.0,5.0,"['get', 'well', 'soon', 'to', 'him']"
342,"God plz save the boy, thank you.",SGD,20000,32.0,7.0,"['god', 'plz', 'save', 'the', 'boy', 'thank', 'you']"
344,Thank you Joy Foundation for helping people in need in this pandemic.,VND,500000,69.0,12.0,"['thank', 'you', 'joy', 'foundation', 'for', 'helping', 'people', 'in', 'need', 'in', 'this', 'pandemic']"
345,Amitabha.,SGD,5000,9.0,1.0,['amitabha']
346,"I donated because when those of us who have more share with those who have less, we can have a better society.",MYR,92000,110.0,22.0,"['i', 'donated', 'because', 'when', 'those', 'of', 'us', 'who', 'have', 'more', 'share', 'with', 'those', 'who', 'have', 'less', 'we', 'can', 'have', 'a', 'better', 'society']"
347,Its just my very small of way contributing towards a childs well being and also feeling gratitude towards god for his grace on us.,SGD,50000,130.0,24.0,"['its', 'just', 'my', 'very', 'small', 'of', 'way', 'contributing', 'towards', 'a', 'childs', 'well', 'being', 'and', 'also', 'feeling', 'gratitude', 'towards', 'god', 'for', 'his', 'grace', 'on', 'us']"
348,D world is filled with LOVE,MYR,16000,27.0,6.0,"['d', 'world', 'is', 'filled', 'with', 'love']"
349,Hope everyone is safe and well,SGD,3000,30.0,6.0,"['hope', 'everyone', 'is', 'safe', 'and', 'well']"
350,God bless the family.. 💖,MYR,20000,24.0,5.0,"['god', 'bless', 'the', 'family']"
351,I wish him a speedy recovery!,SGD,10000,29.0,6.0,"['i', 'wish', 'him', 'a', 'speedy', 'recovery']"
353,Wish you recover soon,SGD,2200,21.0,4.0,"['wish', 'you', 'recover', 'soon']"
354,To assist within our affordability.,SGD,10000,35.0,5.0,"['to', 'assist', 'within', 'our', 'affordability']"
355,I hope he will recover soon. Jia you!,SGD,2000,37.0,8.0,"['i', 'hope', 'he', 'will', 'recover', 'soon', 'jia', 'you']"
356,LOVE,MYR,6300,4.0,1.0,['love']
357,Donated because kid n he needs to get well soon,SGD,3000,47.0,10.0,"['donated', 'because', 'kid', 'n', 'he', 'needs', 'to', 'get', 'well', 'soon']"
358,"Seeing a loved one fighting cancer is tough, please stay strong, keep positive mindset specially around Manidhar, do motivate him. Dont lose hope, keep praying, Singapore medical facilities are great, doctors will do their best.Hare Krishna",SGD,10000,240.0,36.0,"['seeing', 'a', 'loved', 'one', 'fighting', 'cancer', 'is', 'tough', 'please', 'stay', 'strong', 'keep', 'positive', 'mindset', 'specially', 'around', 'manidhar', 'do', 'motivate', 'him', 'dont', 'lose', 'hope', 'keep', 'praying', 'singapore', 'medical', 'facilities', 'are', 'great', 'doctors', 'will', 'do', 'their', 'best', 'hare', 'krishna']"
359,support my friend Shu Juan,SGD,5000,26.0,5.0,"['support', 'my', 'friend', 'shu', 'juan']"
360,So much left to see Manidhar. Be strong and I'm sure you'll get thru this.  I pray God to give you all the strength. Get well soon.,SGD,50000,131.0,28.0,"['so', 'much', 'left', 'to', 'see', 'manidhar', 'be', 'strong', 'and', 'i', 'm', 'sure', 'you', 'll', 'get', 'thru', 'this', 'i', 'pray', 'god', 'to', 'give', 'you', 'all', 'the', 'strength', 'get', 'well', 'soon']"
361,Everyone deserves a help,SGD,5000,24.0,4.0,"['everyone', 'deserves', 'a', 'help']"
362,Help anyone in need when you are able to.,SGD,10000,41.0,9.0,"['help', 'anyone', 'in', 'need', 'when', 'you', 'are', 'able', 'to']"
363,"I donated because I hope to give these children hope, strength and joy while they fight their battles! 🙏🏼",SGD,5000,105.0,19.0,"['i', 'donated', 'because', 'i', 'hope', 'to', 'give', 'these', 'children', 'hope', 'strength', 'and', 'joy', 'while', 'they', 'fight', 'their', 'battles']"
364,I believe that good things always return to me..,SGD,500,48.0,9.0,"['i', 'believe', 'that', 'good', 'things', 'always', 'return', 'to', 'me']"
365,I hope he can help those in need in the future and pass on the love to others,SGD,2200,77.0,18.0,"['i', 'hope', 'he', 'can', 'help', 'those', 'in', 'need', 'in', 'the', 'future', 'and', 'pass', 'on', 'the', 'love', 'to', 'others']"
366,I wish that she has a speedy recovered from her illness and able to return home to the loving care of her family and friends,SGD,5000,124.0,25.0,"['i', 'wish', 'that', 'she', 'has', 'a', 'speedy', 'recovered', 'from', 'her', 'illness', 'and', 'able', 'to', 'return', 'home', 'to', 'the', 'loving', 'care', 'of', 'her', 'family', 'and', 'friends']"
367,Please get well soon!,MYR,10000,21.0,4.0,"['please', 'get', 'well', 'soon']"
368,"My colleague many years ago , from Myanmar, was always very kind to me and even paid an amount for something I owed , which I didn't have a chance to pay him back for. More importantly, it's our duty as medics . God bless the people!",SGD,50000,233.0,47.0,"['my', 'colleague', 'many', 'years', 'ago', 'from', 'myanmar', 'was', 'always', 'very', 'kind', 'to', 'me', 'and', 'even', 'paid', 'an', 'amount', 'for', 'something', 'i', 'owed', 'which', 'i', 'didn', 't', 'have', 'a', 'chance', 'to', 'pay', 'him', 'back', 'for', 'more', 'importantly', 'it', 's', 'our', 'duty', 'as', 'medics', 'god', 'bless', 'the', 'people']"
370,"We love the CEP community and the very important, tireless and life-giving work they do ❤️",SGD,50000,90.0,16.0,"['we', 'love', 'the', 'cep', 'community', 'and', 'the', 'very', 'important', 'tireless', 'and', 'life', 'giving', 'work', 'they', 'do']"
371,Hope he recovers soon.,SGD,5000,22.0,4.0,"['hope', 'he', 'recovers', 'soon']"
372,An incredible doctor with a big heart! ❤,SGD,50000,40.0,8.0,"['an', 'incredible', 'doctor', 'with', 'a', 'big', 'heart']"
373,Donated to help the fight against COVID-19,SGD,2000,42.0,7.0,"['donated', 'to', 'help', 'the', 'fight', 'against', 'covid']"
374,Speedy recovery.,MYR,20000,16.0,2.0,"['speedy', 'recovery']"
375,small contribution,SGD,2000,18.0,2.0,"['small', 'contribution']"
376,Jia you. 妈妈等你回家,SGD,1000,15.0,3.0,"['jia', 'you']"
378,Hope kid will recover faster soon . God bless him.,SGD,20000,50.0,10.0,"['hope', 'kid', 'will', 'recover', 'faster', 'soon', 'god', 'bless', 'him']"
379,I am glad to be of help to someone who needs to overcome his current health issues.,SGD,5000,83.0,17.0,"['i', 'am', 'glad', 'to', 'be', 'of', 'help', 'to', 'someone', 'who', 'needs', 'to', 'overcome', 'his', 'current', 'health', 'issues']"
380,"I wish to see these children to have a better educations in spite of their born autism  conditions !
GOD Blessings to all these children !",SGD,3000,138.0,26.0,"['i', 'wish', 'to', 'see', 'these', 'children', 'to', 'have', 'a', 'better', 'educations', 'in', 'spite', 'of', 'their', 'born', 'autism', 'conditions', 'god', 'blessings', 'to', 'all', 'these', 'children']"
