,comment,currency,amount,text_length,text_wordcount,tokenized_comment
554,"My parents are Malaysians my mum also worked in Singapore previously to support my degree studies overseas. If I can help, I will want to help a mother, a Malaysian, a grandma and a spouse and most of all, a strong pillar for her family.",SGD,5000,237.0,45.0,"['my', 'parents', 'are', 'malaysians', 'my', 'mum', 'also', 'worked', 'in', 'singapore', 'previously', 'to', 'support', 'my', 'degree', 'studies', 'overseas', 'if', 'i', 'can', 'help', 'i', 'will', 'want', 'to', 'help', 'a', 'mother', 'a', 'malaysian', 'a', 'grandma', 'and', 'a', 'spouse', 'and', 'most', 'of', 'all', 'a', 'strong', 'pillar', 'for', 'her', 'family']"
555,"Hope u
Get well soon... ❤️",SGD,1000,26.0,5.0,"['hope', 'u', 'get', 'well', 'soon']"
556,Speedy Recover,SGD,1000,14.0,2.0,"['speedy', 'recover']"
557,To help him and support him,SGD,10000,27.0,6.0,"['to', 'help', 'him', 'and', 'support', 'him']"
558,She needs the money more than I do,SGD,5000,34.0,8.0,"['she', 'needs', 'the', 'money', 'more', 'than', 'i', 'do']"
559,No man or child should go hungry,MYR,20000,32.0,7.0,"['no', 'man', 'or', 'child', 'should', 'go', 'hungry']"
560,Get well soon.,SGD,2000,14.0,3.0,"['get', 'well', 'soon']"
561,I want to help and lighten the burdens in any way,SGD,15000,49.0,11.0,"['i', 'want', 'to', 'help', 'and', 'lighten', 'the', 'burdens', 'in', 'any', 'way']"
562,I hope everyone get a chance to get help and help people. Stay kind and generous.,SGD,2000,81.0,16.0,"['i', 'hope', 'everyone', 'get', 'a', 'chance', 'to', 'get', 'help', 'and', 'help', 'people', 'stay', 'kind', 'and', 'generous']"
563,I don't want to live with regret not trying to help.,SGD,1000,52.0,11.0,"['i', 'don', 't', 'want', 'to', 'live', 'with', 'regret', 'not', 'trying', 'to', 'help']"
564,Donate within affordability,MYR,15000,27.0,3.0,"['donate', 'within', 'affordability']"
565,"God bless the work of your hands. Feed, teach, love the children!",SGD,10000,65.0,12.0,"['god', 'bless', 'the', 'work', 'of', 'your', 'hands', 'feed', 'teach', 'love', 'the', 'children']"
567,Jia you Chee Mun💪,SGD,3000,17.0,4.0,"['jia', 'you', 'chee', 'mun']"
568,Get well soon,SGD,1000,13.0,3.0,"['get', 'well', 'soon']"
569,It's necessary and I can do in my ability,VND,50000,41.0,9.0,"['it', 's', 'necessary', 'and', 'i', 'can', 'do', 'in', 'my', 'ability']"
570,Speedy recovery and all the best to you,SGD,2000,39.0,8.0,"['speedy', 'recovery', 'and', 'all', 'the', 'best', 'to', 'you']"
571,It is a blessing to give and to help those in need. God bless each of them and pray for their good health and well-being.,SGD,40000,121.0,25.0,"['it', 'is', 'a', 'blessing', 'to', 'give', 'and', 'to', 'help', 'those', 'in', 'need', 'god', 'bless', 'each', 'of', 'them', 'and', 'pray', 'for', 'their', 'good', 'health', 'and', 'well', 'being']"
572,It’s heartbreaking to see a child go through this. Would just like to contribute in a small way and hope to ease a bit of the financial burden the child and the family is facing.,SGD,3000,178.0,35.0,"['it', 's', 'heartbreaking', 'to', 'see', 'a', 'child', 'go', 'through', 'this', 'would', 'just', 'like', 'to', 'contribute', 'in', 'a', 'small', 'way', 'and', 'hope', 'to', 'ease', 'a', 'bit', 'of', 'the', 'financial', 'burden', 'the', 'child', 'and', 'the', 'family', 'is', 'facing']"
573,阿弥陀佛. It is heartbreaking to see him going thru all the treatment at such a young age. Get well soon.,SGD,3000,101.0,20.0,"['it', 'is', 'heartbreaking', 'to', 'see', 'him', 'going', 'thru', 'all', 'the', 'treatment', 'at', 'such', 'a', 'young', 'age', 'get', 'well', 'soon']"
574,I hope and pray that this kids gets through this tough time and gets back on his feet and be happy soon.,SGD,20100,104.0,22.0,"['i', 'hope', 'and', 'pray', 'that', 'this', 'kids', 'gets', 'through', 'this', 'tough', 'time', 'and', 'gets', 'back', 'on', 'his', 'feet', 'and', 'be', 'happy', 'soon']"
575,I hope he makes a speedy recovery,SGD,3000,33.0,7.0,"['i', 'hope', 'he', 'makes', 'a', 'speedy', 'recovery']"
576,I wanted to help as much as I can,SGD,10000,33.0,9.0,"['i', 'wanted', 'to', 'help', 'as', 'much', 'as', 'i', 'can']"
577,Speedy recovery!,SGD,5000,16.0,2.0,"['speedy', 'recovery']"
578,Amitabha.,SGD,15000,9.0,1.0,['amitabha']
579,To support Chee Mun,SGD,5000,19.0,4.0,"['to', 'support', 'chee', 'mun']"
580,Speedy recovery to you! Hope that you get well soon and go back to your family ASAP!,SGD,10000,84.0,17.0,"['speedy', 'recovery', 'to', 'you', 'hope', 'that', 'you', 'get', 'well', 'soon', 'and', 'go', 'back', 'to', 'your', 'family', 'asap']"
581,Because I wanted to help,SGD,100,24.0,5.0,"['because', 'i', 'wanted', 'to', 'help']"
582,Speed Recovery,SGD,5000,14.0,2.0,"['speed', 'recovery']"
583,Jia you chee mun. Speedy recovery.,SGD,3000,34.0,6.0,"['jia', 'you', 'chee', 'mun', 'speedy', 'recovery']"
584,I donate a small sum because I try my best to help as I am a cancer patient.  And my husband also passed away on Jan 21 due to Adrenal gland cancer.,SGD,1500,148.0,33.0,"['i', 'donate', 'a', 'small', 'sum', 'because', 'i', 'try', 'my', 'best', 'to', 'help', 'as', 'i', 'am', 'a', 'cancer', 'patient', 'and', 'my', 'husband', 'also', 'passed', 'away', 'on', 'jan', 'due', 'to', 'adrenal', 'gland', 'cancer']"
585,My heart goes out to this sweet child and his family. May god bless him with good health. Please don’t lose hope. Our prayers are with little Manidhar!,SGD,50000,151.0,28.0,"['my', 'heart', 'goes', 'out', 'to', 'this', 'sweet', 'child', 'and', 'his', 'family', 'may', 'god', 'bless', 'him', 'with', 'good', 'health', 'please', 'don', 't', 'lose', 'hope', 'our', 'prayers', 'are', 'with', 'little', 'manidhar']"
586,help when you can,SGD,20000,17.0,4.0,"['help', 'when', 'you', 'can']"
587,#WeCareWeShare,MYR,20000,14.0,1.0,['wecareweshare']
588,It is a blessing to give when there is a need. Pray for her recovery. God bless her and her loved ones.,SGD,25000,103.0,22.0,"['it', 'is', 'a', 'blessing', 'to', 'give', 'when', 'there', 'is', 'a', 'need', 'pray', 'for', 'her', 'recovery', 'god', 'bless', 'her', 'and', 'her', 'loved', 'ones']"
589,Wish you recover soon...,SGD,2000,24.0,4.0,"['wish', 'you', 'recover', 'soon']"
590,Thank you for those who make efforts to improve the life of the children,SGD,5000,72.0,14.0,"['thank', 'you', 'for', 'those', 'who', 'make', 'efforts', 'to', 'improve', 'the', 'life', 'of', 'the', 'children']"
591,I just wish to help lighthen the burden on medical bill. Hope for his recovery.,SGD,5000,79.0,15.0,"['i', 'just', 'wish', 'to', 'help', 'lighthen', 'the', 'burden', 'on', 'medical', 'bill', 'hope', 'for', 'his', 'recovery']"
592,wish recover as soon as can,SGD,5000,27.0,6.0,"['wish', 'recover', 'as', 'soon', 'as', 'can']"
593,It is the least I can do.,SGD,5000,25.0,7.0,"['it', 'is', 'the', 'least', 'i', 'can', 'do']"
594,Get well soon Chloe :),SGD,10000,22.0,5.0,"['get', 'well', 'soon', 'chloe']"
595,It will appears on my fb page and I feel obliged to do so.,MYR,10000,58.0,14.0,"['it', 'will', 'appears', 'on', 'my', 'fb', 'page', 'and', 'i', 'feel', 'obliged', 'to', 'do', 'so']"
596,Giving back to society especially to individuals with special needs.,SGD,5000,68.0,10.0,"['giving', 'back', 'to', 'society', 'especially', 'to', 'individuals', 'with', 'special', 'needs']"
597,Helping each other.,SGD,2000,19.0,3.0,"['helping', 'each', 'other']"
598,Hoping this little contribution can help a child get healthy.,MYR,8000,61.0,10.0,"['hoping', 'this', 'little', 'contribution', 'can', 'help', 'a', 'child', 'get', 'healthy']"
599,"Hope for a smooth recovery for him, his family still much needed his support....",SGD,5000,80.0,14.0,"['hope', 'for', 'a', 'smooth', 'recovery', 'for', 'him', 'his', 'family', 'still', 'much', 'needed', 'his', 'support']"
602,"Praying for his soonest recovery! 
Om SaiRam!",SGD,25000,45.0,7.0,"['praying', 'for', 'his', 'soonest', 'recovery', 'om', 'sairam']"
603,I want to help poor people with no food in the village,SGD,25000,54.0,12.0,"['i', 'want', 'to', 'help', 'poor', 'people', 'with', 'no', 'food', 'in', 'the', 'village']"
604,For India,SGD,500,9.0,2.0,"['for', 'india']"
605,"Wish the child recover soon...
❤️❤️❤️",MYR,6000,37.0,5.0,"['wish', 'the', 'child', 'recover', 'soon']"
606,Get well soon Sweetheart.,MYR,6000,25.0,4.0,"['get', 'well', 'soon', 'sweetheart']"
608,Doing our bit to help families in need.,SGD,20000,39.0,8.0,"['doing', 'our', 'bit', 'to', 'help', 'families', 'in', 'need']"
609,Happy Birthday Amy! This is the best time to Fundraise for such a good cause. May the Blessings be with you always Xoxo!,SGD,10000,120.0,23.0,"['happy', 'birthday', 'amy', 'this', 'is', 'the', 'best', 'time', 'to', 'fundraise', 'for', 'such', 'a', 'good', 'cause', 'may', 'the', 'blessings', 'be', 'with', 'you', 'always', 'xoxo']"
610,Be strong and pray for your speedy recovery 🙏,SGD,5000,45.0,9.0,"['be', 'strong', 'and', 'pray', 'for', 'your', 'speedy', 'recovery']"
611,"May Myanmar have good days again...
😌😌😌",SGD,2000,39.0,6.0,"['may', 'myanmar', 'have', 'good', 'days', 'again']"
613,Praying for your child to recover completely. God loves you!,SGD,10000,60.0,10.0,"['praying', 'for', 'your', 'child', 'to', 'recover', 'completely', 'god', 'loves', 'you']"
614,Hope he gets well soon.,SGD,10000,23.0,5.0,"['hope', 'he', 'gets', 'well', 'soon']"
615,Hopefully he get well soon.,SGD,3000,27.0,5.0,"['hopefully', 'he', 'get', 'well', 'soon']"
618,"Same as an overseas worker, being overseas alone, any precious kindness received are heart-warming. Bless to All.. . 🙏🙏",SGD,10000,119.0,19.0,"['same', 'as', 'an', 'overseas', 'worker', 'being', 'overseas', 'alone', 'any', 'precious', 'kindness', 'received', 'are', 'heart', 'warming', 'bless', 'to', 'all']"
619,Speedy recover,SGD,4400,14.0,2.0,"['speedy', 'recover']"
620,"I wish you a speedy recovery, stay strong and return to your love one back home.",SGD,5000,80.0,16.0,"['i', 'wish', 'you', 'a', 'speedy', 'recovery', 'stay', 'strong', 'and', 'return', 'to', 'your', 'love', 'one', 'back', 'home']"
621,"Mental health is a topic very close to my heart and I believe that we all deserve to live meaningful and fulfilling lives, for which we need to prioritize our mental health :)",SGD,1300,175.0,33.0,"['mental', 'health', 'is', 'a', 'topic', 'very', 'close', 'to', 'my', 'heart', 'and', 'i', 'believe', 'that', 'we', 'all', 'deserve', 'to', 'live', 'meaningful', 'and', 'fulfilling', 'lives', 'for', 'which', 'we', 'need', 'to', 'prioritize', 'our', 'mental', 'health']"
622,"We benefited so much from Bernard and Ying, and the CEP community. Nothing can be more important that protecting and sharing God’s plan of Love to others!",SGD,60000,154.0,27.0,"['we', 'benefited', 'so', 'much', 'from', 'bernard', 'and', 'ying', 'and', 'the', 'cep', 'community', 'nothing', 'can', 'be', 'more', 'important', 'that', 'protecting', 'and', 'sharing', 'god', 's', 'plan', 'of', 'love', 'to', 'others']"
623,"Joceline is a precious little girl. Stay strong & be brave little one :) May your life be a blessing, hope, and testimony for others. Fighting!",MYR,4000,143.0,26.0,"['joceline', 'is', 'a', 'precious', 'little', 'girl', 'stay', 'strong', 'be', 'brave', 'little', 'one', 'may', 'your', 'life', 'be', 'a', 'blessing', 'hope', 'and', 'testimony', 'for', 'others', 'fighting']"
626,Wish to help,SGD,10000,12.0,3.0,"['wish', 'to', 'help']"
627,Get well soon..,SGD,10000,15.0,3.0,"['get', 'well', 'soon']"
628,Pity to him...,SGD,5000,14.0,3.0,"['pity', 'to', 'him']"
631,Please help this family they are in need🙏,SGD,10000,41.0,8.0,"['please', 'help', 'this', 'family', 'they', 'are', 'in', 'need']"
632,"Just doing my bit to help, get well soon, om mani padme hum😊🕉️",MYR,3000,62.0,13.0,"['just', 'doing', 'my', 'bit', 'to', 'help', 'get', 'well', 'soon', 'om', 'mani', 'padme', 'hum']"
633,Thank you for the amazing work that you provide for these treasures!,THB,50000,68.0,12.0,"['thank', 'you', 'for', 'the', 'amazing', 'work', 'that', 'you', 'provide', 'for', 'these', 'treasures']"
634,I want to help,SGD,2000,14.0,4.0,"['i', 'want', 'to', 'help']"
635,I wan the kids stay healthy and happy and sirvived,MYR,10000,50.0,10.0,"['i', 'wan', 'the', 'kids', 'stay', 'healthy', 'and', 'happy', 'and', 'sirvived']"
636,Pay it forward!Count our blessings and give away some of our blessings unto others in need.Majulah Singapura!,SGD,1500,109.0,17.0,"['pay', 'it', 'forward', 'count', 'our', 'blessings', 'and', 'give', 'away', 'some', 'of', 'our', 'blessings', 'unto', 'others', 'in', 'need', 'majulah', 'singapura']"
637,Education should be made accessible to everyone.,SGD,2000,48.0,7.0,"['education', 'should', 'be', 'made', 'accessible', 'to', 'everyone']"
638,"Very sad for him and his loved ones. Islam Haduil, stay strong, keep fighting, give us a chance to bring you back home 💪",SGD,5000,120.0,24.0,"['very', 'sad', 'for', 'him', 'and', 'his', 'loved', 'ones', 'islam', 'haduil', 'stay', 'strong', 'keep', 'fighting', 'give', 'us', 'a', 'chance', 'to', 'bring', 'you', 'back', 'home']"
639,Speedy recovery,SGD,4000,15.0,2.0,"['speedy', 'recovery']"
641,I donated because I believe everyone deserves to study in a good learning environment.,SGD,3000,86.0,14.0,"['i', 'donated', 'because', 'i', 'believe', 'everyone', 'deserves', 'to', 'study', 'in', 'a', 'good', 'learning', 'environment']"
642,"Dear India, please stay strong because miracle will happen!",SGD,2500,59.0,9.0,"['dear', 'india', 'please', 'stay', 'strong', 'because', 'miracle', 'will', 'happen']"
643,Its the month of blessing and sharing with those in need.,SGD,5000,57.0,11.0,"['its', 'the', 'month', 'of', 'blessing', 'and', 'sharing', 'with', 'those', 'in', 'need']"
644,I wanna help!,SGD,6500,13.0,3.0,"['i', 'wanna', 'help']"
645,"Ain society is giving an important support, hope and assistance  to patients and their families.",SGD,20000,96.0,16.0,"['ain', 'society', 'is', 'giving', 'an', 'important', 'support', 'hope', 'and', 'assistance', 'to', 'patients', 'and', 'their', 'families']"
646,Pray for comfort for you and your family. I'm really sorry this happened. My heart goes out to you and your family.,SGD,5000,115.0,22.0,"['pray', 'for', 'comfort', 'for', 'you', 'and', 'your', 'family', 'i', 'm', 'really', 'sorry', 'this', 'happened', 'my', 'heart', 'goes', 'out', 'to', 'you', 'and', 'your', 'family']"
647,I donated because India is currently accounting for almost half the worldwide cases just last week and they deserve more help than they're getting now.,SGD,2500,151.0,25.0,"['i', 'donated', 'because', 'india', 'is', 'currently', 'accounting', 'for', 'almost', 'half', 'the', 'worldwide', 'cases', 'just', 'last', 'week', 'and', 'they', 'deserve', 'more', 'help', 'than', 'they', 're', 'getting', 'now']"
648,"I personally deal with patients who are in need such as these on a daily basis, often with poor social support and have to rely on NGOs such as WAO who have been one the best to work with to help them.",MYR,10000,201.0,42.0,"['i', 'personally', 'deal', 'with', 'patients', 'who', 'are', 'in', 'need', 'such', 'as', 'these', 'on', 'a', 'daily', 'basis', 'often', 'with', 'poor', 'social', 'support', 'and', 'have', 'to', 'rely', 'on', 'ngos', 'such', 'as', 'wao', 'who', 'have', 'been', 'one', 'the', 'best', 'to', 'work', 'with', 'to', 'help', 'them']"
649,amitābha,HKD,600,8.0,1.0,"['amit', 'bha']"
650,Everyone has the right to breath.,SGD,25000,33.0,6.0,"['everyone', 'has', 'the', 'right', 'to', 'breath']"
651,I donated because I can. Because I have the means to help people who are in a very touch spot!,SGD,7500,94.0,20.0,"['i', 'donated', 'because', 'i', 'can', 'because', 'i', 'have', 'the', 'means', 'to', 'help', 'people', 'who', 'are', 'in', 'a', 'very', 'touch', 'spot']"
652,Sharing is caring!,SGD,10000,18.0,3.0,"['sharing', 'is', 'caring']"
653,This is Allah's blessing,SGD,10000,24.0,4.0,"['this', 'is', 'allah', 's', 'blessing']"
654,amitābha,SGD,100,8.0,1.0,"['amit', 'bha']"
655,"May it be the smallest gesture, multiplied by next.",SGD,5000,51.0,9.0,"['may', 'it', 'be', 'the', 'smallest', 'gesture', 'multiplied', 'by', 'next']"
656,I hope Kelly recover soon.,MYR,20000,26.0,5.0,"['i', 'hope', 'kelly', 'recover', 'soon']"
657,The patient's wife is our Ex-colleague. It's our small token of donation and wish her husband speedy recovery.,SGD,118000,110.0,18.0,"['the', 'patient', 's', 'wife', 'is', 'our', 'ex', 'colleague', 'it', 's', 'our', 'small', 'token', 'of', 'donation', 'and', 'wish', 'her', 'husband', 'speedy', 'recovery']"
659,Ramadhan,SGD,5000,8.0,1.0,['ramadhan']
660,Thank you for being such a welcoming community.,SGD,5000,47.0,8.0,"['thank', 'you', 'for', 'being', 'such', 'a', 'welcoming', 'community']"
661,I donated because I feel India need our help .. if we can afford it why not helping ..,SGD,5000,86.0,19.0,"['i', 'donated', 'because', 'i', 'feel', 'india', 'need', 'our', 'help', 'if', 'we', 'can', 'afford', 'it', 'why', 'not', 'helping']"
662,"what i have is better when shared with others who needs it more than i do. apart from that, i feel complete sharing/donating part of what i have. have a blessed day everyone <3",SGD,1000,176.0,34.0,"['what', 'i', 'have', 'is', 'better', 'when', 'shared', 'with', 'others', 'who', 'needs', 'it', 'more', 'than', 'i', 'do', 'apart', 'from', 'that', 'i', 'feel', 'complete', 'sharing', 'donating', 'part', 'of', 'what', 'i', 'have', 'have', 'a', 'blessed', 'day', 'everyone']"
663,Charity will not decrease wealth❤️,SGD,35000,34.0,5.0,"['charity', 'will', 'not', 'decrease', 'wealth']"
664,I feel so sad to hear that.Jia you be strong 💪 Get well soon.,SGD,3000,61.0,14.0,"['i', 'feel', 'so', 'sad', 'to', 'hear', 'that', 'jia', 'you', 'be', 'strong', 'get', 'well', 'soon']"
665,Get well soon,SGD,500,13.0,3.0,"['get', 'well', 'soon']"
666,Get well soon!,MYR,20000,14.0,3.0,"['get', 'well', 'soon']"
667,Speedy recovery !,MYR,5000,17.0,3.0,"['speedy', 'recovery']"
668,My heart breaks for all those losing their loved ones! Stay strong India! ❤️,SGD,75000,76.0,14.0,"['my', 'heart', 'breaks', 'for', 'all', 'those', 'losing', 'their', 'loved', 'ones', 'stay', 'strong', 'india']"
669,God bless Norman and I hope you would be able to undergo surgery,SGD,10000,64.0,13.0,"['god', 'bless', 'norman', 'and', 'i', 'hope', 'you', 'would', 'be', 'able', 'to', 'undergo', 'surgery']"
670,"I donated because I'm a teacher in the SPED sector and I believe that everyone should be given equal chances in education, regardless of abilities.",SGD,100,147.0,25.0,"['i', 'donated', 'because', 'i', 'm', 'a', 'teacher', 'in', 'the', 'sped', 'sector', 'and', 'i', 'believe', 'that', 'everyone', 'should', 'be', 'given', 'equal', 'chances', 'in', 'education', 'regardless', 'of', 'abilities']"
671,I wanted to help,USD,236,16.0,4.0,"['i', 'wanted', 'to', 'help']"
672,To the people that contribute to our country,SGD,1000,44.0,8.0,"['to', 'the', 'people', 'that', 'contribute', 'to', 'our', 'country']"
674,Children are our future,SGD,5000,23.0,4.0,"['children', 'are', 'our', 'future']"
675,Everyone should get an opportunity for a sound Islamic education. It is heartening to see programmes like this and it should definitely be supported.,SGD,17500,149.0,24.0,"['everyone', 'should', 'get', 'an', 'opportunity', 'for', 'a', 'sound', 'islamic', 'education', 'it', 'is', 'heartening', 'to', 'see', 'programmes', 'like', 'this', 'and', 'it', 'should', 'definitely', 'be', 'supported']"
676,"Aa an BTS army I wanted to help 
to make the current situation better even by a little bit.Thank you for giving me a chance to help by doing what I can.",USD,254,152.0,32.0,"['aa', 'an', 'bts', 'army', 'i', 'wanted', 'to', 'help', 'to', 'make', 'the', 'current', 'situation', 'better', 'even', 'by', 'a', 'little', 'bit', 'thank', 'you', 'for', 'giving', 'me', 'a', 'chance', 'to', 'help', 'by', 'doing', 'what', 'i', 'can']"
677,I donated because everyone with critical illness deserves the support they need in order to fight the disease. May Allah make R's road to recovery easy for him and his family.,SGD,5000,175.0,31.0,"['i', 'donated', 'because', 'everyone', 'with', 'critical', 'illness', 'deserves', 'the', 'support', 'they', 'need', 'in', 'order', 'to', 'fight', 'the', 'disease', 'may', 'allah', 'make', 'r', 's', 'road', 'to', 'recovery', 'easy', 'for', 'him', 'and', 'his', 'family']"
678,I donated because I would love to support our Malay/Muslim community.,SGD,5000,69.0,11.0,"['i', 'donated', 'because', 'i', 'would', 'love', 'to', 'support', 'our', 'malay', 'muslim', 'community']"
680,Arlun is a good person.. hope your baby recover soon..,SGD,5000,54.0,10.0,"['arlun', 'is', 'a', 'good', 'person', 'hope', 'your', 'baby', 'recover', 'soon']"
681,I donated because I would like to support patients and family who are suffering from cancer.,SGD,5000,92.0,16.0,"['i', 'donated', 'because', 'i', 'would', 'like', 'to', 'support', 'patients', 'and', 'family', 'who', 'are', 'suffering', 'from', 'cancer']"
682,I donated because of sympathy.,SGD,2000,30.0,5.0,"['i', 'donated', 'because', 'of', 'sympathy']"
683,Digital literacy is an essential skill to have in our world today!,SGD,2000,66.0,12.0,"['digital', 'literacy', 'is', 'an', 'essential', 'skill', 'to', 'have', 'in', 'our', 'world', 'today']"
685,It is my prayer for him to see the love of Christ through His people. My heart and prayers goes out to him and his family..,SGD,2000,123.0,26.0,"['it', 'is', 'my', 'prayer', 'for', 'him', 'to', 'see', 'the', 'love', 'of', 'christ', 'through', 'his', 'people', 'my', 'heart', 'and', 'prayers', 'goes', 'out', 'to', 'him', 'and', 'his', 'family']"
686,"Let us therefore come boldly unto the throne of grace, that we may obtain mercy, and find grace to help in time of need.
‭‭Heb‬ ‭4:16‬ ‭‬‬",SGD,5000,138.0,26.0,"['let', 'us', 'therefore', 'come', 'boldly', 'unto', 'the', 'throne', 'of', 'grace', 'that', 'we', 'may', 'obtain', 'mercy', 'and', 'find', 'grace', 'to', 'help', 'in', 'time', 'of', 'need', 'heb']"
687,Fulfilling my obligations,SGD,17500,25.0,3.0,"['fulfilling', 'my', 'obligations']"
688,"Donated so that the doggie can be healthy again, and to run happy and free",SGD,5000,74.0,15.0,"['donated', 'so', 'that', 'the', 'doggie', 'can', 'be', 'healthy', 'again', 'and', 'to', 'run', 'happy', 'and', 'free']"
690,i care and share to needy❤️,SGD,3000,27.0,6.0,"['i', 'care', 'and', 'share', 'to', 'needy']"
691,Wish speedy recovery,MYR,8000,20.0,3.0,"['wish', 'speedy', 'recovery']"
692,"I donated because I am touched by the father’s love and determination, even setting up the charity with however little he has left.",USD,5000,131.0,23.0,"['i', 'donated', 'because', 'i', 'am', 'touched', 'by', 'the', 'father', 's', 'love', 'and', 'determination', 'even', 'setting', 'up', 'the', 'charity', 'with', 'however', 'little', 'he', 'has', 'left']"
693,My happiness comes from Giving,MYR,20000,30.0,5.0,"['my', 'happiness', 'comes', 'from', 'giving']"
694,"I donated because I believe that people with special needs deserve more opportunities to learn and grow to become contributive to our society, if not equal opportunities as neurotypicals, if meaningful to them.",SGD,12800,210.0,33.0,"['i', 'donated', 'because', 'i', 'believe', 'that', 'people', 'with', 'special', 'needs', 'deserve', 'more', 'opportunities', 'to', 'learn', 'and', 'grow', 'to', 'become', 'contributive', 'to', 'our', 'society', 'if', 'not', 'equal', 'opportunities', 'as', 'neurotypicals', 'if', 'meaningful', 'to', 'them']"
695,To help a life,SGD,5000,14.0,4.0,"['to', 'help', 'a', 'life']"
696,I just want to help.,SGD,2000,20.0,5.0,"['i', 'just', 'want', 'to', 'help']"
697,"You are saving lives. Giving second chances. Filling hungry tummies. Making  tails wag in happiness. 
May almighty Allah bless you with the strength and support you need to continue the beautiful work you are doing.",USD,2000,215.0,36.0,"['you', 'are', 'saving', 'lives', 'giving', 'second', 'chances', 'filling', 'hungry', 'tummies', 'making', 'tails', 'wag', 'in', 'happiness', 'may', 'almighty', 'allah', 'bless', 'you', 'with', 'the', 'strength', 'and', 'support', 'you', 'need', 'to', 'continue', 'the', 'beautiful', 'work', 'you', 'are', 'doing']"
698,I hope that Kelly will find a suitable bone marrow donor and make a full recovery. Stay positive and strong!,MYR,20000,108.0,20.0,"['i', 'hope', 'that', 'kelly', 'will', 'find', 'a', 'suitable', 'bone', 'marrow', 'donor', 'and', 'make', 'a', 'full', 'recovery', 'stay', 'positive', 'and', 'strong']"
699,"I wish you're going to recover soon and take care of your family, need not to let them worry about you. Stay strong, stay healthy, you will get better.",SGD,2000,151.0,29.0,"['i', 'wish', 'you', 're', 'going', 'to', 'recover', 'soon', 'and', 'take', 'care', 'of', 'your', 'family', 'need', 'not', 'to', 'let', 'them', 'worry', 'about', 'you', 'stay', 'strong', 'stay', 'healthy', 'you', 'will', 'get', 'better']"
700,Every child deserve a chance. Stay strong !,MYR,50000,43.0,8.0,"['every', 'child', 'deserve', 'a', 'chance', 'stay', 'strong']"
701,I donated because we should help people in need.we can help them in all sorts of ways.,SGD,10000,86.0,17.0,"['i', 'donated', 'because', 'we', 'should', 'help', 'people', 'in', 'need', 'we', 'can', 'help', 'them', 'in', 'all', 'sorts', 'of', 'ways']"
702,everyone deserves an equal chance to live their best life,SGD,1500,57.0,10.0,"['everyone', 'deserves', 'an', 'equal', 'chance', 'to', 'live', 'their', 'best', 'life']"
703,"It's a long road to recovery, not only for Alex but also for SunSun and family. Hopefully, my contribution provide some support/relief.",SGD,2000,135.0,22.0,"['it', 's', 'a', 'long', 'road', 'to', 'recovery', 'not', 'only', 'for', 'alex', 'but', 'also', 'for', 'sunsun', 'and', 'family', 'hopefully', 'my', 'contribution', 'provide', 'some', 'support', 'relief']"
