,comment,currency,amount,text_length,text_wordcount,tokenized_comment
381,It makes me feel good to be able to help another living being.,SGD,5000,62.0,13.0,"['it', 'makes', 'me', 'feel', 'good', 'to', 'be', 'able', 'to', 'help', 'another', 'living', 'being']"
382,"If God were to give him a chance to live again, we should help to make sure he lives for the betterness in life. Please do good in return for good.",SGD,3000,147.0,31.0,"['if', 'god', 'were', 'to', 'give', 'him', 'a', 'chance', 'to', 'live', 'again', 'we', 'should', 'help', 'to', 'make', 'sure', 'he', 'lives', 'for', 'the', 'betterness', 'in', 'life', 'please', 'do', 'good', 'in', 'return', 'for', 'good']"
383,"Hope our token of contribution can help in chee mun's medical expense.
... JT_ML",SGD,20000,80.0,13.0,"['hope', 'our', 'token', 'of', 'contribution', 'can', 'help', 'in', 'chee', 'mun', 's', 'medical', 'expense', 'jt', 'ml']"
384,Share of love,SGD,2000,13.0,3.0,"['share', 'of', 'love']"
385,I want to,SGD,1000,9.0,3.0,"['i', 'want', 'to']"
386,The youth today are our leaders n change makers for tomorrow.,SGD,10000,61.0,11.0,"['the', 'youth', 'today', 'are', 'our', 'leaders', 'n', 'change', 'makers', 'for', 'tomorrow']"
387,We want donate this money to cover his medical expenses.  Will pray Almighty for his speedy recovery.,SGD,10000,101.0,18.0,"['we', 'want', 'donate', 'this', 'money', 'to', 'cover', 'his', 'medical', 'expenses', 'will', 'pray', 'almighty', 'for', 'his', 'speedy', 'recovery']"
388,i donated because i truly believe in this cause and want to do my part to fulfil these children’s wishes and bring joy into their lives :),SGD,500,138.0,27.0,"['i', 'donated', 'because', 'i', 'truly', 'believe', 'in', 'this', 'cause', 'and', 'want', 'to', 'do', 'my', 'part', 'to', 'fulfil', 'these', 'children', 's', 'wishes', 'and', 'bring', 'joy', 'into', 'their', 'lives']"
389,May have a speedy recovery.,SGD,2000,27.0,5.0,"['may', 'have', 'a', 'speedy', 'recovery']"
390,I hope they have bright future same and others.,SGD,3000,47.0,9.0,"['i', 'hope', 'they', 'have', 'bright', 'future', 'same', 'and', 'others']"
392,God bless 🙏🏻,SGD,5000,12.0,3.0,"['god', 'bless']"
393,Myanmar needs help,SGD,2000,18.0,3.0,"['myanmar', 'needs', 'help']"
394,Wishing her to speedy recovery soon.,SGD,3000,36.0,6.0,"['wishing', 'her', 'to', 'speedy', 'recovery', 'soon']"
395,Manidhar - may god give you strength and will power to overcome this situation.,SGD,5000,79.0,14.0,"['manidhar', 'may', 'god', 'give', 'you', 'strength', 'and', 'will', 'power', 'to', 'overcome', 'this', 'situation']"
397,I hope this sweetness of mine can help those in need😊❤️,SGD,5000,55.0,11.0,"['i', 'hope', 'this', 'sweetness', 'of', 'mine', 'can', 'help', 'those', 'in', 'need']"
398,Helping needed,SGD,3000,14.0,2.0,"['helping', 'needed']"
399,it came to mind today. I found out about it long ago on a youtube channel called asianboss. I was very touched by the story.,USD,6000,124.0,25.0,"['it', 'came', 'to', 'mind', 'today', 'i', 'found', 'out', 'about', 'it', 'long', 'ago', 'on', 'a', 'youtube', 'channel', 'called', 'asianboss', 'i', 'was', 'very', 'touched', 'by', 'the', 'story']"
400,Take care.. Good luck,SGD,2000,21.0,4.0,"['take', 'care', 'good', 'luck']"
401,I donated because I feel sorry for abandoned and homeless kitties. The whole community shoukd play a part in helping🙏,SGD,5000,117.0,20.0,"['i', 'donated', 'because', 'i', 'feel', 'sorry', 'for', 'abandoned', 'and', 'homeless', 'kitties', 'the', 'whole', 'community', 'shoukd', 'play', 'a', 'part', 'in', 'helping']"
402,I want Mila's children to see her mother.,SGD,5000,41.0,8.0,"['i', 'want', 'mila', 's', 'children', 'to', 'see', 'her', 'mother']"
403,why not,SGD,2000,7.0,2.0,"['why', 'not']"
405,"Grow well and stay strong. Love, Nyla and Lina",SGD,2000,46.0,9.0,"['grow', 'well', 'and', 'stay', 'strong', 'love', 'nyla', 'and', 'lina']"
406,Be kind to others,SGD,90000,17.0,4.0,"['be', 'kind', 'to', 'others']"
407,Sharing love is beautiful.,SGD,10000,26.0,4.0,"['sharing', 'love', 'is', 'beautiful']"
408,Hope both siblings will grow up healthy and the parents to be less financially strained :(,MYR,7800,90.0,16.0,"['hope', 'both', 'siblings', 'will', 'grow', 'up', 'healthy', 'and', 'the', 'parents', 'to', 'be', 'less', 'financially', 'strained']"
409,Be someone sunshine and do our best to contribute to tis society...,SGD,5000,67.0,12.0,"['be', 'someone', 'sunshine', 'and', 'do', 'our', 'best', 'to', 'contribute', 'to', 'tis', 'society']"
410,i donates because i want to give a little help to the needy.,SGD,5000,60.0,13.0,"['i', 'donates', 'because', 'i', 'want', 'to', 'give', 'a', 'little', 'help', 'to', 'the', 'needy']"
411,"In this pandemic, we should help each other especially the one that far away from family like Malaysian in Singapore. Stay strong brother",SGD,500,137.0,23.0,"['in', 'this', 'pandemic', 'we', 'should', 'help', 'each', 'other', 'especially', 'the', 'one', 'that', 'far', 'away', 'from', 'family', 'like', 'malaysian', 'in', 'singapore', 'stay', 'strong', 'brother']"
412,I feel the pain.,SGD,5000,16.0,4.0,"['i', 'feel', 'the', 'pain']"
414,Help to save the life. Every bit counts.,SGD,15000,40.0,8.0,"['help', 'to', 'save', 'the', 'life', 'every', 'bit', 'counts']"
415,"Provide help when a fellow countryman is in dire straits, hope he would have a speedy recovery as his kids are still way too young",SGD,5000,130.0,25.0,"['provide', 'help', 'when', 'a', 'fellow', 'countryman', 'is', 'in', 'dire', 'straits', 'hope', 'he', 'would', 'have', 'a', 'speedy', 'recovery', 'as', 'his', 'kids', 'are', 'still', 'way', 'too', 'young']"
416,Nothing,SGD,1000,7.0,1.0,['nothing']
417,I want to give back to the needy while I can help,SGD,5000,49.0,12.0,"['i', 'want', 'to', 'give', 'back', 'to', 'the', 'needy', 'while', 'i', 'can', 'help']"
419,I care,SGD,10000,6.0,2.0,"['i', 'care']"
420,"From one mom to another, stay strong and wishing you & your children a bright future ahead.. From seeing your photos alone I feel you are a beautiful person & doesn't let life gets you down. Love and hugs!",SGD,10000,205.0,39.0,"['from', 'one', 'mom', 'to', 'another', 'stay', 'strong', 'and', 'wishing', 'you', 'your', 'children', 'a', 'bright', 'future', 'ahead', 'from', 'seeing', 'your', 'photos', 'alone', 'i', 'feel', 'you', 'are', 'a', 'beautiful', 'person', 'doesn', 't', 'let', 'life', 'gets', 'you', 'down', 'love', 'and', 'hugs']"
421,To help the poor strays been abandoned by heartless owners.,SGD,5000,59.0,10.0,"['to', 'help', 'the', 'poor', 'strays', 'been', 'abandoned', 'by', 'heartless', 'owners']"
422,May the Lord bless you. May you recover and bless others in future through acts of service or in kind.,SGD,25000,102.0,20.0,"['may', 'the', 'lord', 'bless', 'you', 'may', 'you', 'recover', 'and', 'bless', 'others', 'in', 'future', 'through', 'acts', 'of', 'service', 'or', 'in', 'kind']"
423,Praying for you!,SGD,5000,16.0,3.0,"['praying', 'for', 'you']"
424,I care,SGD,2000,6.0,2.0,"['i', 'care']"
425,Giving back to the society.,SGD,500,27.0,5.0,"['giving', 'back', 'to', 'the', 'society']"
427,"Helping someone in need is a part of humanity.  Let us support him and lend him a hand. He's now depending on kindness of strangers- doesn't matter how small. Let's do more than caring, let's actually help when we can.",SGD,1000,218.0,41.0,"['helping', 'someone', 'in', 'need', 'is', 'a', 'part', 'of', 'humanity', 'let', 'us', 'support', 'him', 'and', 'lend', 'him', 'a', 'hand', 'he', 's', 'now', 'depending', 'on', 'kindness', 'of', 'strangers', 'doesn', 't', 'matter', 'how', 'small', 'let', 's', 'do', 'more', 'than', 'caring', 'let', 's', 'actually', 'help', 'when', 'we', 'can']"
428,I donated because we are living in this unprecedented time during this pandemic where many have been negatively impacted in one way or another. We are thankful for being able to help some of these people. Hope we'll ride out this soon.,SGD,25000,235.0,42.0,"['i', 'donated', 'because', 'we', 'are', 'living', 'in', 'this', 'unprecedented', 'time', 'during', 'this', 'pandemic', 'where', 'many', 'have', 'been', 'negatively', 'impacted', 'in', 'one', 'way', 'or', 'another', 'we', 'are', 'thankful', 'for', 'being', 'able', 'to', 'help', 'some', 'of', 'these', 'people', 'hope', 'we', 'll', 'ride', 'out', 'this', 'soon']"
429,I donated because we humans must help each other in times of difficulty. I pray the little boy recovers completely without suffering much. God Bless!,SGD,30000,149.0,25.0,"['i', 'donated', 'because', 'we', 'humans', 'must', 'help', 'each', 'other', 'in', 'times', 'of', 'difficulty', 'i', 'pray', 'the', 'little', 'boy', 'recovers', 'completely', 'without', 'suffering', 'much', 'god', 'bless']"
430,Giving back to the society.,SGD,500,27.0,5.0,"['giving', 'back', 'to', 'the', 'society']"
431,I understand his situation now,SGD,3000,30.0,5.0,"['i', 'understand', 'his', 'situation', 'now']"
432,Hope get well soon be strong,SGD,2000,28.0,6.0,"['hope', 'get', 'well', 'soon', 'be', 'strong']"
433,it is good to save human's life. even small amount can help the kind family if add on.,SGD,5000,86.0,18.0,"['it', 'is', 'good', 'to', 'save', 'human', 's', 'life', 'even', 'small', 'amount', 'can', 'help', 'the', 'kind', 'family', 'if', 'add', 'on']"
434,I love the spirit with which you guys take up causes. More strength to you ! Poj,SGD,50000,80.0,17.0,"['i', 'love', 'the', 'spirit', 'with', 'which', 'you', 'guys', 'take', 'up', 'causes', 'more', 'strength', 'to', 'you', 'poj']"
436,Hope will be getting health,SGD,1000,27.0,5.0,"['hope', 'will', 'be', 'getting', 'health']"
437,he is just like family that needs help,SGD,5000,38.0,8.0,"['he', 'is', 'just', 'like', 'family', 'that', 'needs', 'help']"
438,"I donated as I wish to contribute to the kittens in my own way. 
I understand everyone has their own challenges, but let's do our part to extend some love and kindness to each other",SGD,3000,181.0,35.0,"['i', 'donated', 'as', 'i', 'wish', 'to', 'contribute', 'to', 'the', 'kittens', 'in', 'my', 'own', 'way', 'i', 'understand', 'everyone', 'has', 'their', 'own', 'challenges', 'but', 'let', 's', 'do', 'our', 'part', 'to', 'extend', 'some', 'love', 'and', 'kindness', 'to', 'each', 'other']"
439,Get well soon,SGD,1200,13.0,3.0,"['get', 'well', 'soon']"
440,Just a small gesture to help another human being..,SGD,5000,50.0,9.0,"['just', 'a', 'small', 'gesture', 'to', 'help', 'another', 'human', 'being']"
441,Just wanna do my part.,SGD,5000,22.0,5.0,"['just', 'wanna', 'do', 'my', 'part']"
442,I hope that he and the family members don’t have to worry about paying back the medical expenses after his recovery. Jia you! Rest well!,SGD,2000,136.0,25.0,"['i', 'hope', 'that', 'he', 'and', 'the', 'family', 'members', 'don', 't', 'have', 'to', 'worry', 'about', 'paying', 'back', 'the', 'medical', 'expenses', 'after', 'his', 'recovery', 'jia', 'you', 'rest', 'well']"
443,Just a little help that's within my ability to give. Hope for the best for them.,SGD,1000,80.0,16.0,"['just', 'a', 'little', 'help', 'that', 's', 'within', 'my', 'ability', 'to', 'give', 'hope', 'for', 'the', 'best', 'for', 'them']"
444,God has blessed me to bless others,SGD,10000,34.0,7.0,"['god', 'has', 'blessed', 'me', 'to', 'bless', 'others']"
446,Give our best to help,SGD,2000,21.0,5.0,"['give', 'our', 'best', 'to', 'help']"
447,CEP did so much for our marriage. Please continue your good work,SGD,25000,64.0,12.0,"['cep', 'did', 'so', 'much', 'for', 'our', 'marriage', 'please', 'continue', 'your', 'good', 'work']"
448,I feel for the people of India... This pandemic can help awaken more compassion n unity of the nation and the planet. Help wherever you are to those in need! Let india know you care.,SGD,22200,182.0,35.0,"['i', 'feel', 'for', 'the', 'people', 'of', 'india', 'this', 'pandemic', 'can', 'help', 'awaken', 'more', 'compassion', 'n', 'unity', 'of', 'the', 'nation', 'and', 'the', 'planet', 'help', 'wherever', 'you', 'are', 'to', 'those', 'in', 'need', 'let', 'india', 'know', 'you', 'care']"
451,I hope my donation will allow the patients to just focus on recovery and not worry about financials,SGD,15000,99.0,18.0,"['i', 'hope', 'my', 'donation', 'will', 'allow', 'the', 'patients', 'to', 'just', 'focus', 'on', 'recovery', 'and', 'not', 'worry', 'about', 'financials']"
452,I'm touched by his story of working hard to support his family in msia. Hope more people will help him ❤️,SGD,3000,105.0,21.0,"['i', 'm', 'touched', 'by', 'his', 'story', 'of', 'working', 'hard', 'to', 'support', 'his', 'family', 'in', 'msia', 'hope', 'more', 'people', 'will', 'help', 'him']"
455,"I care, thank you to all the migrant workers for their contributions. Bless all",SGD,2000,79.0,14.0,"['i', 'care', 'thank', 'you', 'to', 'all', 'the', 'migrant', 'workers', 'for', 'their', 'contributions', 'bless', 'all']"
456,Speedy recovery ! From HMR .,MYR,5000,28.0,6.0,"['speedy', 'recovery', 'from', 'hmr']"
457,Speedy recovery 💪🏻,SGD,1000,18.0,3.0,"['speedy', 'recovery']"
458,"We can’t help everyone,but everyone can help someone

Pray that baby ishan,speedy recovery back to his family.",SGD,1000,110.0,16.0,"['we', 'can', 't', 'help', 'everyone', 'but', 'everyone', 'can', 'help', 'someone', 'pray', 'that', 'baby', 'ishan', 'speedy', 'recovery', 'back', 'to', 'his', 'family']"
459,Inspired by the young charitable hearts,SGD,1000,39.0,6.0,"['inspired', 'by', 'the', 'young', 'charitable', 'hearts']"
460,This is a good cause and one to be supported.,SGD,5000,45.0,10.0,"['this', 'is', 'a', 'good', 'cause', 'and', 'one', 'to', 'be', 'supported']"
461,Sharing is caring. Wish everyone will help her. Wish her speedy recovery 🙏🏼,SGD,2000,75.0,13.0,"['sharing', 'is', 'caring', 'wish', 'everyone', 'will', 'help', 'her', 'wish', 'her', 'speedy', 'recovery']"
462,I donate to a worthy cause,SGD,25000,26.0,6.0,"['i', 'donate', 'to', 'a', 'worthy', 'cause']"
463,Saving a life is humanity.,SGD,10000,26.0,5.0,"['saving', 'a', 'life', 'is', 'humanity']"
464,"Wishing the little boy a speedy recovery. For his parent, be strong & don't give up. Your child need your support & you are surrounded by supporting & loving people who cares to help.",SGD,10000,183.0,34.0,"['wishing', 'the', 'little', 'boy', 'a', 'speedy', 'recovery', 'for', 'his', 'parent', 'be', 'strong', 'don', 't', 'give', 'up', 'your', 'child', 'need', 'your', 'support', 'you', 'are', 'surrounded', 'by', 'supporting', 'loving', 'people', 'who', 'cares', 'to', 'help']"
465,Every child have a chance to see the world.,SGD,5000,43.0,9.0,"['every', 'child', 'have', 'a', 'chance', 'to', 'see', 'the', 'world']"
466,She needed,SGD,5000,10.0,2.0,"['she', 'needed']"
467,Keep fighting! ♥️♥️,SGD,1300,19.0,3.0,"['keep', 'fighting']"
468,"Everyone is working for a earning. And it is not a easy decision to ask a help from public. 
Hope this small donation can help him go through this hard Time and no worry on the medical fees.",SGD,10000,190.0,38.0,"['everyone', 'is', 'working', 'for', 'a', 'earning', 'and', 'it', 'is', 'not', 'a', 'easy', 'decision', 'to', 'ask', 'a', 'help', 'from', 'public', 'hope', 'this', 'small', 'donation', 'can', 'help', 'him', 'go', 'through', 'this', 'hard', 'time', 'and', 'no', 'worry', 'on', 'the', 'medical', 'fees']"
469,"We need to support needy people in the society for medical, education, food & livelihood.",SGD,5000,89.0,15.0,"['we', 'need', 'to', 'support', 'needy', 'people', 'in', 'the', 'society', 'for', 'medical', 'education', 'food', 'livelihood']"
472,because I can help others less fortunate,SGD,10000,40.0,7.0,"['because', 'i', 'can', 'help', 'others', 'less', 'fortunate']"
473,help the needs,SGD,3500,14.0,3.0,"['help', 'the', 'needs']"
474,He needs it,SGD,5000,11.0,3.0,"['he', 'needs', 'it']"
476,It is a way to say thank you.,SGD,20000,29.0,8.0,"['it', 'is', 'a', 'way', 'to', 'say', 'thank', 'you']"
477,i want to help the family to reconnect,SGD,5000,38.0,8.0,"['i', 'want', 'to', 'help', 'the', 'family', 'to', 'reconnect']"
478,I wish little boy Manidhar a speedy recovery ❤️ Every child deserves a healthy life and bright future 🙏🏼 It’s painful to see innocent children in this condition .,SGD,2000,162.0,29.0,"['i', 'wish', 'little', 'boy', 'manidhar', 'a', 'speedy', 'recovery', 'every', 'child', 'deserves', 'a', 'healthy', 'life', 'and', 'bright', 'future', 'it', 's', 'painful', 'to', 'see', 'innocent', 'children', 'in', 'this', 'condition']"
479,Help in whatever way we can.,SGD,3000,28.0,6.0,"['help', 'in', 'whatever', 'way', 'we', 'can']"
480,Just doing my part…,SGD,5000,19.0,4.0,"['just', 'doing', 'my', 'part']"
481,We all should help one another  ❤,SGD,1000,33.0,8.0,"['we', 'all', 'should', 'help', 'one', 'another']"
483,Many memories with TNS. Supporting them for this good cause.,SGD,5000,60.0,10.0,"['many', 'memories', 'with', 'tns', 'supporting', 'them', 'for', 'this', 'good', 'cause']"
484,To do my little part by sharing during this difficult times,SGD,50000,59.0,11.0,"['to', 'do', 'my', 'little', 'part', 'by', 'sharing', 'during', 'this', 'difficult', 'times']"
485,Gambateh,SGD,3000,8.0,1.0,['gambateh']
486,I want to help the needy n the poor.,SGD,25000,36.0,9.0,"['i', 'want', 'to', 'help', 'the', 'needy', 'n', 'the', 'poor']"
487,I wish every kid is healthy and happy,SGD,2000,37.0,8.0,"['i', 'wish', 'every', 'kid', 'is', 'healthy', 'and', 'happy']"
488,Sharing is caring,SGD,1000,17.0,3.0,"['sharing', 'is', 'caring']"
489,he’s a young man that deserves to live the rest of his life,SGD,1000,59.0,13.0,"['he', 's', 'a', 'young', 'man', 'that', 'deserves', 'to', 'live', 'the', 'rest', 'of', 'his', 'life']"
490,Msians .. our neighbours!,MYR,80000,25.0,4.0,"['msians', 'our', 'neighbours']"
491,Everybody deserves a chance at life. I hope the family can get through this together.,SGD,3000,85.0,15.0,"['everybody', 'deserves', 'a', 'chance', 'at', 'life', 'i', 'hope', 'the', 'family', 'can', 'get', 'through', 'this', 'together']"
492,Get well soon dear .,SGD,10000,20.0,5.0,"['get', 'well', 'soon', 'dear']"
495,"Be brave, boy. Get well soon!",SGD,5000,29.0,6.0,"['be', 'brave', 'boy', 'get', 'well', 'soon']"
496,I want to help.,MYR,10000,15.0,4.0,"['i', 'want', 'to', 'help']"
497,"If you have the mean to, WHy not? If we are given, we are blessed, why give not. Yishi yishi, good enough, does not matter the amount.  What say you?",SGD,10000,149.0,31.0,"['if', 'you', 'have', 'the', 'mean', 'to', 'why', 'not', 'if', 'we', 'are', 'given', 'we', 'are', 'blessed', 'why', 'give', 'not', 'yishi', 'yishi', 'good', 'enough', 'does', 'not', 'matter', 'the', 'amount', 'what', 'say', 'you']"
498,hope it helps,MYR,8000,13.0,3.0,"['hope', 'it', 'helps']"
499,"No amount is small. No prayer is short. If you are reading it , pls donate any amount. May you live a happy and healthy life.",SGD,1500,125.0,26.0,"['no', 'amount', 'is', 'small', 'no', 'prayer', 'is', 'short', 'if', 'you', 'are', 'reading', 'it', 'pls', 'donate', 'any', 'amount', 'may', 'you', 'live', 'a', 'happy', 'and', 'healthy', 'life']"
500,Just do it,MYR,6000,10.0,3.0,"['just', 'do', 'it']"
501,Sharing is caring,SGD,200,17.0,3.0,"['sharing', 'is', 'caring']"
502,I want to do a small part for these children and praying they will recover.,SGD,3000,75.0,15.0,"['i', 'want', 'to', 'do', 'a', 'small', 'part', 'for', 'these', 'children', 'and', 'praying', 'they', 'will', 'recover']"
503,Just a little help that's within my ability to give. Hope for the best for them.,SGD,1000,80.0,16.0,"['just', 'a', 'little', 'help', 'that', 's', 'within', 'my', 'ability', 'to', 'give', 'hope', 'for', 'the', 'best', 'for', 'them']"
504,Save baby. That's enough,SGD,10000,24.0,4.0,"['save', 'baby', 'that', 's', 'enough']"
505,every life matters! God speed!,SGD,5000,30.0,5.0,"['every', 'life', 'matters', 'god', 'speed']"
507,Hoping fir his speedy recovery 🙏🙏🙏,SGD,5000,34.0,6.0,"['hoping', 'fir', 'his', 'speedy', 'recovery']"
508,I donated because helping people... give him a chance recoverd soon,SGD,1000,67.0,11.0,"['i', 'donated', 'because', 'helping', 'people', 'give', 'him', 'a', 'chance', 'recoverd', 'soon']"
509,Your small heart of donation can help him to recover from his surgery and reunite with his love ones in Malaysia. Speedy recovery!,SGD,5000,130.0,23.0,"['your', 'small', 'heart', 'of', 'donation', 'can', 'help', 'him', 'to', 'recover', 'from', 'his', 'surgery', 'and', 'reunite', 'with', 'his', 'love', 'ones', 'in', 'malaysia', 'speedy', 'recovery']"
510,I wish the family can reunited together and enjoy more family ties and time and my hearts and prayer for you. May God bless and heal you and speedy recovery,SGD,10000,156.0,30.0,"['i', 'wish', 'the', 'family', 'can', 'reunited', 'together', 'and', 'enjoy', 'more', 'family', 'ties', 'and', 'time', 'and', 'my', 'hearts', 'and', 'prayer', 'for', 'you', 'may', 'god', 'bless', 'and', 'heal', 'you', 'and', 'speedy', 'recovery']"
511,Help strayed cats to find a good home,SGD,5000,37.0,8.0,"['help', 'strayed', 'cats', 'to', 'find', 'a', 'good', 'home']"
512,Hopefully get well soon 🙏🏻,SGD,2000,26.0,5.0,"['hopefully', 'get', 'well', 'soon']"
514,There is no foot too small that it cannot leave it's imprint on this world.,SGD,1000,75.0,15.0,"['there', 'is', 'no', 'foot', 'too', 'small', 'that', 'it', 'cannot', 'leave', 'it', 's', 'imprint', 'on', 'this', 'world']"
515,#lovemoredonthate,SGD,1000,17.0,1.0,['lovemoredonthate']
516,TRY HELPING EACH OTHERS.,SGD,500,24.0,4.0,"['try', 'helping', 'each', 'others']"
517,little help.,MYR,10000,12.0,2.0,"['little', 'help']"
518,"I have been in a similar situation and know that a helping hand, however small, means a lot to the donees. God bless the child!",SGD,50000,127.0,25.0,"['i', 'have', 'been', 'in', 'a', 'similar', 'situation', 'and', 'know', 'that', 'a', 'helping', 'hand', 'however', 'small', 'means', 'a', 'lot', 'to', 'the', 'donees', 'god', 'bless', 'the', 'child']"
520,Just a small contribution.. Hope could make a little different to someone who is in need..,MYR,20000,90.0,16.0,"['just', 'a', 'small', 'contribution', 'hope', 'could', 'make', 'a', 'little', 'different', 'to', 'someone', 'who', 'is', 'in', 'need']"
521,gws,SGD,2000,3.0,1.0,['gws']
522,I hope a little donation can help him out,SGD,1800,41.0,9.0,"['i', 'hope', 'a', 'little', 'donation', 'can', 'help', 'him', 'out']"
523,everyone deserve a good treat,SGD,3000,29.0,5.0,"['everyone', 'deserve', 'a', 'good', 'treat']"
525,I donated because this is a world issue. We have to contribute at least to make the world better.,SGD,10000,97.0,19.0,"['i', 'donated', 'because', 'this', 'is', 'a', 'world', 'issue', 'we', 'have', 'to', 'contribute', 'at', 'least', 'to', 'make', 'the', 'world', 'better']"
527,"Everyone deserved the chance to live, esp during this time",SGD,5000,58.0,10.0,"['everyone', 'deserved', 'the', 'chance', 'to', 'live', 'esp', 'during', 'this', 'time']"
529,I would like the child to have a chance to enjoy a happy childhood and grow up healthy.,SGD,10000,87.0,18.0,"['i', 'would', 'like', 'the', 'child', 'to', 'have', 'a', 'chance', 'to', 'enjoy', 'a', 'happy', 'childhood', 'and', 'grow', 'up', 'healthy']"
530,"Father God, we humbly pray for chee mun who are fighting Pheochromocytoma .Give him the hope and courage him need each day.Comfort him in his pain and bless him with healing.Strengthen his family,friends,and caregivers.In Jesus’ name,Amen!",SGD,5400,239.0,36.0,"['father', 'god', 'we', 'humbly', 'pray', 'for', 'chee', 'mun', 'who', 'are', 'fighting', 'pheochromocytoma', 'give', 'him', 'the', 'hope', 'and', 'courage', 'him', 'need', 'each', 'day', 'comfort', 'him', 'in', 'his', 'pain', 'and', 'bless', 'him', 'with', 'healing', 'strengthen', 'his', 'family', 'friends', 'and', 'caregivers', 'in', 'jesus', 'name', 'amen']"
531,i donated because I wish him to get well soon after surgery .,SGD,2000,61.0,13.0,"['i', 'donated', 'because', 'i', 'wish', 'him', 'to', 'get', 'well', 'soon', 'after', 'surgery']"
533,"Sharing the rezki given by Allah SWT, 
Alhamdulillah 
All Praises to Allah",MYR,1000,74.0,12.0,"['sharing', 'the', 'rezki', 'given', 'by', 'allah', 'swt', 'alhamdulillah', 'all', 'praises', 'to', 'allah']"
535,We will get through these hard times. Malaysia don't give up!,MYR,20000,61.0,11.0,"['we', 'will', 'get', 'through', 'these', 'hard', 'times', 'malaysia', 'don', 't', 'give', 'up']"
536,"Just practing to do donation regulary, hope everything will work smooth & dream come true soon.",SGD,100,95.0,16.0,"['just', 'practing', 'to', 'do', 'donation', 'regulary', 'hope', 'everything', 'will', 'work', 'smooth', 'dream', 'come', 'true', 'soon']"
537,Get well soon,SGD,1000,13.0,3.0,"['get', 'well', 'soon']"
539,stay strong.add oil,SGD,4000,19.0,3.0,"['stay', 'strong', 'add', 'oil']"
540,I donated this because i sympathy on his current condition and hope he can recover soon. God bless him.,SGD,5000,103.0,19.0,"['i', 'donated', 'this', 'because', 'i', 'sympathy', 'on', 'his', 'current', 'condition', 'and', 'hope', 'he', 'can', 'recover', 'soon', 'god', 'bless', 'him']"
541,Hoping I can help others,SGD,2500,24.0,5.0,"['hoping', 'i', 'can', 'help', 'others']"
542,Hoping to help,SGD,5000,14.0,3.0,"['hoping', 'to', 'help']"
543,Save Myanmar,SGD,5000,12.0,2.0,"['save', 'myanmar']"
544,I want to give his family courage to have faith and strength on this battle.,SGD,1000,76.0,15.0,"['i', 'want', 'to', 'give', 'his', 'family', 'courage', 'to', 'have', 'faith', 'and', 'strength', 'on', 'this', 'battle']"
546,I too have a kid this age,SGD,2000,25.0,7.0,"['i', 'too', 'have', 'a', 'kid', 'this', 'age']"
547,I hope him recover soon,SGD,5000,23.0,5.0,"['i', 'hope', 'him', 'recover', 'soon']"
548,Jiayou ! Fighting! And get well soon!,SGD,5000,37.0,7.0,"['jiayou', 'fighting', 'and', 'get', 'well', 'soon']"
552,Wish you speedy recovery!!!,SGD,2000,27.0,4.0,"['wish', 'you', 'speedy', 'recovery']"
553,I am also a Malaysian working in Singapore.,SGD,2800,43.0,8.0,"['i', 'am', 'also', 'a', 'malaysian', 'working', 'in', 'singapore']"
