,comment,currency,amount,text_length,text_wordcount,tokenized_comment,token_lem,token_pstem,cleaned_lem,cleaned_pstem,cluster,x0,x1,cluster1,x0_1,x1_1,dbscan_cluster,x0_2,x1_2
711,Give them a chance to see this beautiful world.,MYR,30000,47.0,9.0,"['give', 'them', 'a', 'chance', 'to', 'see', 'this', 'beautiful', 'world']","['give', 'them', 'a', 'chance', 'to', 'see', 'this', 'beautiful', 'world']","['give', 'them', 'a', 'chanc', 'to', 'see', 'thi', 'beauti', 'world']",give them a chance to see this beautiful world,give them a chanc to see thi beauti world,0,-0.0720809069438678,-0.08097862407550134,0,-0.1177385765827371,-0.19136271022947765,0,-0.1177385765827371,-0.19136271022947765
712,I care,SGD,2000,6.0,2.0,"['i', 'care']","['i', 'care']","['i', 'care']",i care,i care,0,-0.056285736426676336,-0.016075780473231965,0,-0.11482108422760981,-0.1868135052035774,0,-0.11482108422760981,-0.1868135052035774
713,Wish him a speedy recovery,SGD,3000,26.0,5.0,"['wish', 'him', 'a', 'speedy', 'recovery']","['wish', 'him', 'a', 'speedy', 'recovery']","['wish', 'him', 'a', 'speedi', 'recoveri']",wish him a speedy recovery,wish him a speedi recoveri,3,-0.10212354947658314,0.8265253371638419,0,-0.30415804627691984,1.198553467670917,0,-0.30415804627691984,1.198553467670917
714,I believe in love ❤️🤗,SGD,3000,21.0,5.0,"['i', 'believe', 'in', 'love']","['i', 'believe', 'in', 'love']","['i', 'believ', 'in', 'love']",i believe in love,i believ in love,0,-0.0731394805721931,-0.05296704602176273,0,-0.1568128037416008,-0.2208976314446326,0,-0.1568128037416008,-0.2208976314446326
715,Wishing the best...,SGD,25000,19.0,3.0,"['wishing', 'the', 'best']","['wishing', 'the', 'best']","['wish', 'the', 'best']",wishing the best,wish the best,0,-0.051892135584599354,0.0027993680705355284,0,-0.12246258480662285,-0.17948617552340498,0,-0.12246258480662285,-0.17948617552340498
716,I love cats,SGD,3000,11.0,3.0,"['i', 'love', 'cats']","['i', 'love', 'cat']","['i', 'love', 'cat']",i love cat,i love cat,0,-0.07592030025644549,-0.04972798820886893,0,-0.13863307977613196,-0.20501182224412798,0,-0.13863307977613196,-0.20501182224412798
717,I am a working mum and often cant find time to contribute charity in terms of effort & time. The least I can do is contribute monetary aid wherever needed. In Syaa Allah this charity is blessed by Allah and benefit those in need.,SGD,5000,229.0,44.0,"['i', 'am', 'a', 'working', 'mum', 'and', 'often', 'cant', 'find', 'time', 'to', 'contribute', 'charity', 'in', 'terms', 'of', 'effort', 'time', 'the', 'least', 'i', 'can', 'do', 'is', 'contribute', 'monetary', 'aid', 'wherever', 'needed', 'in', 'syaa', 'allah', 'this', 'charity', 'is', 'blessed', 'by', 'allah', 'and', 'benefit', 'those', 'in', 'need']","['i', 'am', 'a', 'working', 'mum', 'and', 'often', 'cant', 'find', 'time', 'to', 'contribute', 'charity', 'in', 'term', 'of', 'effort', 'time', 'the', 'least', 'i', 'can', 'do', 'is', 'contribute', 'monetary', 'aid', 'wherever', 'needed', 'in', 'syaa', 'allah', 'this', 'charity', 'is', 'blessed', 'by', 'allah', 'and', 'benefit', 'those', 'in', 'need']","['i', 'am', 'a', 'work', 'mum', 'and', 'often', 'cant', 'find', 'time', 'to', 'contribut', 'chariti', 'in', 'term', 'of', 'effort', 'time', 'the', 'least', 'i', 'can', 'do', 'is', 'contribut', 'monetari', 'aid', 'wherev', 'need', 'in', 'syaa', 'allah', 'thi', 'chariti', 'is', 'bless', 'by', 'allah', 'and', 'benefit', 'those', 'in', 'need']",i am a working mum and often cant find time to contribute charity in term of effort time the least i can do is contribute monetary aid wherever needed in syaa allah this charity is blessed by allah and benefit those in need,i am a work mum and often cant find time to contribut chariti in term of effort time the least i can do is contribut monetari aid wherev need in syaa allah thi chariti is bless by allah and benefit those in need,0,-0.07323774507609453,-0.08892867746012188,0,-0.2742841258220972,-0.18283440725245026,-1,-0.2742841258220972,-0.18283440725245026
718,I care about Baby Avery.,SGD,7500,24.0,5.0,"['i', 'care', 'about', 'baby', 'avery']","['i', 'care', 'about', 'baby', 'avery']","['i', 'care', 'about', 'babi', 'averi']",i care about baby avery,i care about babi averi,0,-0.05336222770757958,-0.02090027408483206,0,-0.10196445928527946,-0.14192329532087294,0,-0.10196445928527946,-0.14192329532087294
719,"I donated because i believe animals are campanions of us .
To brighten up or lives .
To comfort us whenever we are down. 
They are angels sent by god for us.",SGD,5000,157.0,30.0,"['i', 'donated', 'because', 'i', 'believe', 'animals', 'are', 'campanions', 'of', 'us', 'to', 'brighten', 'up', 'or', 'lives', 'to', 'comfort', 'us', 'whenever', 'we', 'are', 'down', 'they', 'are', 'angels', 'sent', 'by', 'god', 'for', 'us']","['i', 'donated', 'because', 'i', 'believe', 'animal', 'are', 'campanions', 'of', 'u', 'to', 'brighten', 'up', 'or', 'life', 'to', 'comfort', 'u', 'whenever', 'we', 'are', 'down', 'they', 'are', 'angel', 'sent', 'by', 'god', 'for', 'u']","['i', 'donat', 'becaus', 'i', 'believ', 'anim', 'are', 'campanion', 'of', 'us', 'to', 'brighten', 'up', 'or', 'live', 'to', 'comfort', 'us', 'whenev', 'we', 'are', 'down', 'they', 'are', 'angel', 'sent', 'by', 'god', 'for', 'us']",i donated because i believe animal are campanions of u to brighten up or life to comfort u whenever we are down they are angel sent by god for u,i donat becaus i believ anim are campanion of us to brighten up or live to comfort us whenev we are down they are angel sent by god for us,0,-0.07692066494001505,-0.03007053964953063,0,-0.20645160972590096,0.0654783258055704,0,-0.20645160972590096,0.0654783258055704
720,I donated because there will always be someone who will really need the help.,SGD,10000,77.0,14.0,"['i', 'donated', 'because', 'there', 'will', 'always', 'be', 'someone', 'who', 'will', 'really', 'need', 'the', 'help']","['i', 'donated', 'because', 'there', 'will', 'always', 'be', 'someone', 'who', 'will', 'really', 'need', 'the', 'help']","['i', 'donat', 'becaus', 'there', 'will', 'alway', 'be', 'someon', 'who', 'will', 'realli', 'need', 'the', 'help']",i donated because there will always be someone who will really need the help,i donat becaus there will alway be someon who will realli need the help,2,-0.08191562393782265,-0.16302715716994284,0,-0.15329384040836358,-0.27888023977942794,0,-0.15329384040836358,-0.27888023977942794
722,I have seen how Ain Society render help to needy cancer patients and I believe in their cause.,SGD,1000,94.0,18.0,"['i', 'have', 'seen', 'how', 'ain', 'society', 'render', 'help', 'to', 'needy', 'cancer', 'patients', 'and', 'i', 'believe', 'in', 'their', 'cause']","['i', 'have', 'seen', 'how', 'ain', 'society', 'render', 'help', 'to', 'needy', 'cancer', 'patient', 'and', 'i', 'believe', 'in', 'their', 'cause']","['i', 'have', 'seen', 'how', 'ain', 'societi', 'render', 'help', 'to', 'needi', 'cancer', 'patient', 'and', 'i', 'believ', 'in', 'their', 'caus']",i have seen how ain society render help to needy cancer patient and i believe in their cause,i have seen how ain societi render help to needi cancer patient and i believ in their caus,0,-0.0641906118842522,-0.04962092928877109,0,-0.16229421843067413,-0.29572833689554595,0,-0.16229421843067413,-0.29572833689554595
723,Hope Kelly can get the best treatment and recover soon.,MYR,50000,55.0,10.0,"['hope', 'kelly', 'can', 'get', 'the', 'best', 'treatment', 'and', 'recover', 'soon']","['hope', 'kelly', 'can', 'get', 'the', 'best', 'treatment', 'and', 'recover', 'soon']","['hope', 'kelli', 'can', 'get', 'the', 'best', 'treatment', 'and', 'recov', 'soon']",hope kelly can get the best treatment and recover soon,hope kelli can get the best treatment and recov soon,0,0.15989423065332276,0.04972610498401376,0,0.5458208445162457,-0.08398897739651805,0,0.5458208445162457,-0.08398897739651805
724,I like to donate,USD,1000,16.0,4.0,"['i', 'like', 'to', 'donate']","['i', 'like', 'to', 'donate']","['i', 'like', 'to', 'donat']",i like to donate,i like to donat,0,-0.04648830191817162,-0.03977960323991267,0,-0.106712794115914,-0.2166573669564227,0,-0.106712794115914,-0.2166573669564227
726,Hopefully a little help goes a long way,SGD,4500,39.0,8.0,"['hopefully', 'a', 'little', 'help', 'goes', 'a', 'long', 'way']","['hopefully', 'a', 'little', 'help', 'go', 'a', 'long', 'way']","['hope', 'a', 'littl', 'help', 'goe', 'a', 'long', 'way']",hopefully a little help go a long way,hope a littl help goe a long way,0,-0.06414943638527161,-0.029317021223495072,0,-0.10673889517552067,-0.10566546684611705,0,-0.10673889517552067,-0.10566546684611705
727,Pity,MYR,10000,4.0,1.0,['pity'],['pity'],['piti'],pity,piti,0,-0.03731340525798722,-0.01937314478888192,0,-0.11088799687211007,-0.21522336475909584,0,-0.11088799687211007,-0.21522336475909584
728,HELPING THE KIDS IN SEEKING KNOWLEDGE. INSYALLAH,SGD,20000,48.0,7.0,"['helping', 'the', 'kids', 'in', 'seeking', 'knowledge', 'insyallah']","['helping', 'the', 'kid', 'in', 'seeking', 'knowledge', 'insyallah']","['help', 'the', 'kid', 'in', 'seek', 'knowledg', 'insyallah']",helping the kid in seeking knowledge insyallah,help the kid in seek knowledg insyallah,0,-0.05664470095314161,-0.04682673084020862,0,-0.12745409175292516,-0.18680367021565447,0,-0.12745409175292516,-0.18680367021565447
729,He is a new and capable colleague. Hope that any amount can help to lighten parent burden for this family.,SGD,10000,106.0,20.0,"['he', 'is', 'a', 'new', 'and', 'capable', 'colleague', 'hope', 'that', 'any', 'amount', 'can', 'help', 'to', 'lighten', 'parent', 'burden', 'for', 'this', 'family']","['he', 'is', 'a', 'new', 'and', 'capable', 'colleague', 'hope', 'that', 'any', 'amount', 'can', 'help', 'to', 'lighten', 'parent', 'burden', 'for', 'this', 'family']","['he', 'is', 'a', 'new', 'and', 'capabl', 'colleagu', 'hope', 'that', 'ani', 'amount', 'can', 'help', 'to', 'lighten', 'parent', 'burden', 'for', 'thi', 'famili']",he is a new and capable colleague hope that any amount can help to lighten parent burden for this family,he is a new and capabl colleagu hope that ani amount can help to lighten parent burden for thi famili,0,-0.07120304687244998,-0.02148010154382037,0,-0.2061409493214207,0.05384304902835099,0,-0.2061409493214207,0.05384304902835099
731,Well wishes,SGD,5000,11.0,2.0,"['well', 'wishes']","['well', 'wish']","['well', 'wish']",well wish,well wish,1,0.3479840649571719,0.13614585499036974,0,0.42162309163727973,-0.02072164972833234,0,0.42162309163727973,-0.02072164972833234
732,Humanity!,SGD,7000,9.0,1.0,['humanity'],['humanity'],['human'],humanity,human,0,-0.03731340525798722,-0.01937314478888192,0,-0.11088799687211007,-0.21522336475909584,0,-0.11088799687211007,-0.21522336475909584
733,Well wishes,SGD,5000,11.0,2.0,"['well', 'wishes']","['well', 'wish']","['well', 'wish']",well wish,well wish,1,0.3479840649571719,0.13614585499036974,0,0.42162309163727973,-0.02072164972833234,0,0.42162309163727973,-0.02072164972833234
735,to help,SGD,30000,7.0,2.0,"['to', 'help']","['to', 'help']","['to', 'help']",to help,to help,0,-0.03731340525798722,-0.01937314478888192,0,-0.11088799687211007,-0.21522336475909584,0,-0.11088799687211007,-0.21522336475909584
736,Hope recover soon,SGD,2000,17.0,3.0,"['hope', 'recover', 'soon']","['hope', 'recover', 'soon']","['hope', 'recov', 'soon']",hope recover soon,hope recov soon,0,-0.0724155098100697,0.13753440679854506,0,-0.10743990099987072,-0.15481236221400432,0,-0.10743990099987072,-0.15481236221400432
737,BTS and ARMY will always be together to make the world a better place.,USD,200,70.0,14.0,"['bts', 'and', 'army', 'will', 'always', 'be', 'together', 'to', 'make', 'the', 'world', 'a', 'better', 'place']","['bts', 'and', 'army', 'will', 'always', 'be', 'together', 'to', 'make', 'the', 'world', 'a', 'better', 'place']","['bt', 'and', 'armi', 'will', 'alway', 'be', 'togeth', 'to', 'make', 'the', 'world', 'a', 'better', 'place']",bts and army will always be together to make the world a better place,bt and armi will alway be togeth to make the world a better place,0,-0.05494774585875647,-0.0677450925982883,0,-0.11306946233655436,-0.2970891509095599,0,-0.11306946233655436,-0.2970891509095599
738,I am just doing my part to the society,SGD,20000,38.0,9.0,"['i', 'am', 'just', 'doing', 'my', 'part', 'to', 'the', 'society']","['i', 'am', 'just', 'doing', 'my', 'part', 'to', 'the', 'society']","['i', 'am', 'just', 'do', 'my', 'part', 'to', 'the', 'societi']",i am just doing my part to the society,i am just do my part to the societi,0,-0.05625388893601734,-0.04442601983673911,0,-0.13247615578059918,-0.25480146213045535,0,-0.13247615578059918,-0.25480146213045535
739,"To give is better than to receive and I hope my small amount helps out, with everyone giving their little it meant more to the receiver 🙏",SGD,2000,137.0,27.0,"['to', 'give', 'is', 'better', 'than', 'to', 'receive', 'and', 'i', 'hope', 'my', 'small', 'amount', 'helps', 'out', 'with', 'everyone', 'giving', 'their', 'little', 'it', 'meant', 'more', 'to', 'the', 'receiver']","['to', 'give', 'is', 'better', 'than', 'to', 'receive', 'and', 'i', 'hope', 'my', 'small', 'amount', 'help', 'out', 'with', 'everyone', 'giving', 'their', 'little', 'it', 'meant', 'more', 'to', 'the', 'receiver']","['to', 'give', 'is', 'better', 'than', 'to', 'receiv', 'and', 'i', 'hope', 'my', 'small', 'amount', 'help', 'out', 'with', 'everyon', 'give', 'their', 'littl', 'it', 'meant', 'more', 'to', 'the', 'receiv']",to give is better than to receive and i hope my small amount help out with everyone giving their little it meant more to the receiver,to give is better than to receiv and i hope my small amount help out with everyon give their littl it meant more to the receiv,0,-0.07929387559059581,-0.0740343490002713,0,-0.20940917068953166,-0.1390448751185432,0,-0.20940917068953166,-0.1390448751185432
740,Well wishes,MYR,30000,11.0,2.0,"['well', 'wishes']","['well', 'wish']","['well', 'wish']",well wish,well wish,1,0.3479840649571719,0.13614585499036974,0,0.42162309163727973,-0.02072164972833234,0,0.42162309163727973,-0.02072164972833234
741,A small token from me hope can help them,SGD,5000,40.0,9.0,"['a', 'small', 'token', 'from', 'me', 'hope', 'can', 'help', 'them']","['a', 'small', 'token', 'from', 'me', 'hope', 'can', 'help', 'them']","['a', 'small', 'token', 'from', 'me', 'hope', 'can', 'help', 'them']",a small token from me hope can help them,a small token from me hope can help them,0,-0.04847658770060571,-0.0191370704213085,0,-0.12645559391509206,-0.18206888632660462,0,-0.12645559391509206,-0.18206888632660462
742,Giving hope,SGD,5000,11.0,2.0,"['giving', 'hope']","['giving', 'hope']","['give', 'hope']",giving hope,give hope,0,-0.05551923518234646,-0.04439658139008252,0,-0.1273780307411669,-0.23637568067840525,0,-0.1273780307411669,-0.23637568067840525
743,i donated because everyone deserves a chance,MYR,2000,44.0,7.0,"['i', 'donated', 'because', 'everyone', 'deserves', 'a', 'chance']","['i', 'donated', 'because', 'everyone', 'deserves', 'a', 'chance']","['i', 'donat', 'becaus', 'everyon', 'deserv', 'a', 'chanc']",i donated because everyone deserves a chance,i donat becaus everyon deserv a chanc,0,-0.04372513948869976,-0.05507952214700019,0,-0.12149001689350944,-0.2487870858922492,0,-0.12149001689350944,-0.2487870858922492
744,Fellow humans,SGD,1000,13.0,2.0,"['fellow', 'humans']","['fellow', 'human']","['fellow', 'human']",fellow human,fellow human,0,-0.03731340525798722,-0.01937314478888192,0,-0.11088799687211007,-0.21522336475909584,0,-0.11088799687211007,-0.21522336475909584
745,Don’t give up .. the Beighter days is just around the corner. Loves Ang light to you.,SGD,5000,85.0,17.0,"['don', 't', 'give', 'up', 'the', 'beighter', 'days', 'is', 'just', 'around', 'the', 'corner', 'loves', 'ang', 'light', 'to', 'you']","['don', 't', 'give', 'up', 'the', 'beighter', 'day', 'is', 'just', 'around', 'the', 'corner', 'love', 'ang', 'light', 'to', 'you']","['don', 't', 'give', 'up', 'the', 'beighter', 'day', 'is', 'just', 'around', 'the', 'corner', 'love', 'ang', 'light', 'to', 'you']",don t give up the beighter day is just around the corner love ang light to you,don t give up the beighter day is just around the corner love ang light to you,0,-0.09016376237856516,-0.07971597270589843,0,-0.16967228765409245,-0.17544429331128097,0,-0.16967228765409245,-0.17544429331128097
746,I just want to help,SGD,10000,19.0,5.0,"['i', 'just', 'want', 'to', 'help']","['i', 'just', 'want', 'to', 'help']","['i', 'just', 'want', 'to', 'help']",i just want to help,i just want to help,0,-0.1273616548443031,-0.1835920566587105,0,-0.17855182462182712,-0.24911825846211813,0,-0.17855182462182712,-0.24911825846211813
747,I care for him,MYR,10000,14.0,4.0,"['i', 'care', 'for', 'him']","['i', 'care', 'for', 'him']","['i', 'care', 'for', 'him']",i care for him,i care for him,0,-0.056285736426676336,-0.016075780473231965,0,-0.11482108422760981,-0.1868135052035774,0,-0.11482108422760981,-0.1868135052035774
749,we once need help and someonehelp us..,SGD,9000,38.0,7.0,"['we', 'once', 'need', 'help', 'and', 'someonehelp', 'us']","['we', 'once', 'need', 'help', 'and', 'someonehelp', 'u']","['we', 'onc', 'need', 'help', 'and', 'someonehelp', 'us']",we once need help and someonehelp u,we onc need help and someonehelp us,2,-0.12289347513898173,-0.2920715150548208,0,-0.15804206374357763,-0.2739301599601193,0,-0.15804206374357763,-0.2739301599601193
750,Every child deserves the right to education.,SGD,11500,44.0,7.0,"['every', 'child', 'deserves', 'the', 'right', 'to', 'education']","['every', 'child', 'deserves', 'the', 'right', 'to', 'education']","['everi', 'child', 'deserv', 'the', 'right', 'to', 'educ']",every child deserves the right to education,everi child deserv the right to educ,0,-0.0434458016764268,-0.032598441690842625,0,-0.08622068566792782,-0.132081298099522,0,-0.08622068566792782,-0.132081298099522
752,I have been in state where I have no money to buy food and clothes for my child. I know the feeling of hard to get by day by day.,SGD,5000,129.0,30.0,"['i', 'have', 'been', 'in', 'state', 'where', 'i', 'have', 'no', 'money', 'to', 'buy', 'food', 'and', 'clothes', 'for', 'my', 'child', 'i', 'know', 'the', 'feeling', 'of', 'hard', 'to', 'get', 'by', 'day', 'by', 'day']","['i', 'have', 'been', 'in', 'state', 'where', 'i', 'have', 'no', 'money', 'to', 'buy', 'food', 'and', 'clothes', 'for', 'my', 'child', 'i', 'know', 'the', 'feeling', 'of', 'hard', 'to', 'get', 'by', 'day', 'by', 'day']","['i', 'have', 'been', 'in', 'state', 'where', 'i', 'have', 'no', 'money', 'to', 'buy', 'food', 'and', 'cloth', 'for', 'my', 'child', 'i', 'know', 'the', 'feel', 'of', 'hard', 'to', 'get', 'by', 'day', 'by', 'day']",i have been in state where i have no money to buy food and clothes for my child i know the feeling of hard to get by day by day,i have been in state where i have no money to buy food and cloth for my child i know the feel of hard to get by day by day,0,0.1550436538964143,-0.015603087822719545,0,0.48818995128164977,-0.013145401904088215,0,0.48818995128164977,-0.013145401904088215
753,Jesus heals you Amen 🙏,MYR,1000,22.0,5.0,"['jesus', 'heals', 'you', 'amen']","['jesus', 'heals', 'you', 'amen']","['jesu', 'heal', 'you', 'amen']",jesus heals you amen,jesu heal you amen,0,-0.04695600398899132,-0.028331244252034173,0,-0.12097754569970336,-0.21394670572788616,0,-0.12097754569970336,-0.21394670572788616
754,To help,SGD,10000,7.0,2.0,"['to', 'help']","['to', 'help']","['to', 'help']",to help,to help,0,-0.03731340525798722,-0.01937314478888192,0,-0.11088799687211007,-0.21522336475909584,0,-0.11088799687211007,-0.21522336475909584
755,The humble people of Timor-Leste have lived through countless hardships over many years but always come out stronger. Let's help them overcome yet another challenge.,SGD,10000,165.0,25.0,"['the', 'humble', 'people', 'of', 'timor', 'leste', 'have', 'lived', 'through', 'countless', 'hardships', 'over', 'many', 'years', 'but', 'always', 'come', 'out', 'stronger', 'let', 's', 'help', 'them', 'overcome', 'yet', 'another', 'challenge']","['the', 'humble', 'people', 'of', 'timor', 'leste', 'have', 'lived', 'through', 'countless', 'hardship', 'over', 'many', 'year', 'but', 'always', 'come', 'out', 'stronger', 'let', 's', 'help', 'them', 'overcome', 'yet', 'another', 'challenge']","['the', 'humbl', 'peopl', 'of', 'timor', 'lest', 'have', 'live', 'through', 'countless', 'hardship', 'over', 'mani', 'year', 'but', 'alway', 'come', 'out', 'stronger', 'let', 's', 'help', 'them', 'overcom', 'yet', 'anoth', 'challeng']",the humble people of timor leste have lived through countless hardship over many year but always come out stronger let s help them overcome yet another challenge,the humbl peopl of timor lest have live through countless hardship over mani year but alway come out stronger let s help them overcom yet anoth challeng,2,-0.058030560116466144,-0.08222901724584833,0,-0.13926697977069635,-0.2763800614415727,0,-0.13926697977069635,-0.2763800614415727
756,I donated because i want to help other people.,MYR,5000,46.0,9.0,"['i', 'donated', 'because', 'i', 'want', 'to', 'help', 'other', 'people']","['i', 'donated', 'because', 'i', 'want', 'to', 'help', 'other', 'people']","['i', 'donat', 'becaus', 'i', 'want', 'to', 'help', 'other', 'peopl']",i donated because i want to help other people,i donat becaus i want to help other peopl,2,-0.13037588614970844,-0.2083409789685062,0,-0.21629881703565623,-0.2821087834817405,0,-0.21629881703565623,-0.2821087834817405
757,I care!,SGD,25000,7.0,2.0,"['i', 'care']","['i', 'care']","['i', 'care']",i care,i care,0,-0.056285736426676336,-0.016075780473231965,0,-0.11482108422760981,-0.1868135052035774,0,-0.11482108422760981,-0.1868135052035774
760,"I donated to Kelly Chan, her mom is my secondary classmate , hope Kelly Chan speedy Recovery",MYR,20000,92.0,17.0,"['i', 'donated', 'to', 'kelly', 'chan', 'her', 'mom', 'is', 'my', 'secondary', 'classmate', 'hope', 'kelly', 'chan', 'speedy', 'recovery']","['i', 'donated', 'to', 'kelly', 'chan', 'her', 'mom', 'is', 'my', 'secondary', 'classmate', 'hope', 'kelly', 'chan', 'speedy', 'recovery']","['i', 'donat', 'to', 'kelli', 'chan', 'her', 'mom', 'is', 'my', 'secondari', 'classmat', 'hope', 'kelli', 'chan', 'speedi', 'recoveri']",i donated to kelly chan her mom is my secondary classmate hope kelly chan speedy recovery,i donat to kelli chan her mom is my secondari classmat hope kelli chan speedi recoveri,3,-0.12449112076869778,0.8581377129795612,0,-0.3111589815015091,1.0578809944858856,0,-0.3111589815015091,1.0578809944858856
761,Its good to give when able.,MYR,50000,27.0,6.0,"['its', 'good', 'to', 'give', 'when', 'able']","['it', 'good', 'to', 'give', 'when', 'able']","['it', 'good', 'to', 'give', 'when', 'abl']",it good to give when able,it good to give when abl,0,-0.08130809520213532,-0.061355319941453615,0,-0.19191138720425746,-0.186523707564986,0,-0.19191138720425746,-0.186523707564986
763,I also gave 2 kids and working alone in singapore and kids in msia. I understand how difficulities for this family. Hope my small token can help a little for them.,SGD,500,163.0,31.0,"['i', 'also', 'gave', 'kids', 'and', 'working', 'alone', 'in', 'singapore', 'and', 'kids', 'in', 'msia', 'i', 'understand', 'how', 'difficulities', 'for', 'this', 'family', 'hope', 'my', 'small', 'token', 'can', 'help', 'a', 'little', 'for', 'them']","['i', 'also', 'gave', 'kid', 'and', 'working', 'alone', 'in', 'singapore', 'and', 'kid', 'in', 'msia', 'i', 'understand', 'how', 'difficulities', 'for', 'this', 'family', 'hope', 'my', 'small', 'token', 'can', 'help', 'a', 'little', 'for', 'them']","['i', 'also', 'gave', 'kid', 'and', 'work', 'alon', 'in', 'singapor', 'and', 'kid', 'in', 'msia', 'i', 'understand', 'how', 'difficul', 'for', 'thi', 'famili', 'hope', 'my', 'small', 'token', 'can', 'help', 'a', 'littl', 'for', 'them']",i also gave kid and working alone in singapore and kid in msia i understand how difficulities for this family hope my small token can help a little for them,i also gave kid and work alon in singapor and kid in msia i understand how difficul for thi famili hope my small token can help a littl for them,0,-0.06839872737692955,-0.016916841555519122,0,-0.20824830516884182,0.26453560160285633,-1,-0.20824830516884182,0.26453560160285633
764,Just want to help,SGD,5000,17.0,4.0,"['just', 'want', 'to', 'help']","['just', 'want', 'to', 'help']","['just', 'want', 'to', 'help']",just want to help,just want to help,0,-0.1273616548443031,-0.1835920566587105,0,-0.17855182462182712,-0.24911825846211813,0,-0.17855182462182712,-0.24911825846211813
765,"Don't shine so others can see me, shine so that through me, others can see Him, Jesus Christ.  Amen",SGD,5000,99.0,20.0,"['don', 't', 'shine', 'so', 'others', 'can', 'see', 'me', 'shine', 'so', 'that', 'through', 'me', 'others', 'can', 'see', 'him', 'jesus', 'christ', 'amen']","['don', 't', 'shine', 'so', 'others', 'can', 'see', 'me', 'shine', 'so', 'that', 'through', 'me', 'others', 'can', 'see', 'him', 'jesus', 'christ', 'amen']","['don', 't', 'shine', 'so', 'other', 'can', 'see', 'me', 'shine', 'so', 'that', 'through', 'me', 'other', 'can', 'see', 'him', 'jesu', 'christ', 'amen']",don t shine so others can see me shine so that through me others can see him jesus christ amen,don t shine so other can see me shine so that through me other can see him jesu christ amen,0,-0.06209831942600621,-0.06868862200174364,0,-0.06827675367556306,-0.16765686083815176,-1,-0.06827675367556306,-0.16765686083815176
766,Every dollar counts...,SGD,1000,22.0,3.0,"['every', 'dollar', 'counts']","['every', 'dollar', 'count']","['everi', 'dollar', 'count']",every dollar count,everi dollar count,0,-0.045511891805086156,-0.03447095897604715,0,-0.10948400271728394,-0.2136714548009027,0,-0.10948400271728394,-0.2136714548009027
