,comment,currency,amount,text_length,text_wordcount,tokenized_comment,token_lem,token_pstem,cleaned_lem,cleaned_pstem,cluster,x0,x1,cluster1,x0_1,x1_1,dbscan_cluster,x0_2,x1_2
240,"My family donated because we believe we should help each other, we wish Manidhar all the best with his treatment.",SGD,5000,113.0,20.0,"['my', 'family', 'donated', 'because', 'we', 'believe', 'we', 'should', 'help', 'each', 'other', 'we', 'wish', 'manidhar', 'all', 'the', 'best', 'with', 'his', 'treatment']","['my', 'family', 'donated', 'because', 'we', 'believe', 'we', 'should', 'help', 'each', 'other', 'we', 'wish', 'manidhar', 'all', 'the', 'best', 'with', 'his', 'treatment']","['my', 'famili', 'donat', 'becaus', 'we', 'believ', 'we', 'should', 'help', 'each', 'other', 'we', 'wish', 'manidhar', 'all', 'the', 'best', 'with', 'hi', 'treatment']",my family donated because we believe we should help each other we wish manidhar all the best with his treatment,my famili donat becaus we believ we should help each other we wish manidhar all the best with hi treatment,0,-0.04053794109739047,0.04559532039528881,0,-0.1181408349901898,0.1950780210830868,0,-0.1181408349901898,0.1950780210830868
241,A sick person needed help,SGD,10000,25.0,5.0,"['a', 'sick', 'person', 'needed', 'help']","['a', 'sick', 'person', 'needed', 'help']","['a', 'sick', 'person', 'need', 'help']",a sick person needed help,a sick person need help,0,-0.049328975821865725,-0.012307256876573284,0,-0.1226373785584669,-0.2050135189656463,0,-0.1226373785584669,-0.2050135189656463
243,I want to help people in need.,SGD,5000,30.0,7.0,"['i', 'want', 'to', 'help', 'people', 'in', 'need']","['i', 'want', 'to', 'help', 'people', 'in', 'need']","['i', 'want', 'to', 'help', 'peopl', 'in', 'need']",i want to help people in need,i want to help peopl in need,2,-0.16134124081984388,-0.32277940360208984,0,-0.26345288390712396,-0.3408155786827639,0,-0.26345288390712396,-0.3408155786827639
244,This kid deserves to live and I really hope his treatment goes well and to become healthy and happy,SGD,2000,99.0,19.0,"['this', 'kid', 'deserves', 'to', 'live', 'and', 'i', 'really', 'hope', 'his', 'treatment', 'goes', 'well', 'and', 'to', 'become', 'healthy', 'and', 'happy']","['this', 'kid', 'deserves', 'to', 'live', 'and', 'i', 'really', 'hope', 'his', 'treatment', 'go', 'well', 'and', 'to', 'become', 'healthy', 'and', 'happy']","['thi', 'kid', 'deserv', 'to', 'live', 'and', 'i', 'realli', 'hope', 'hi', 'treatment', 'goe', 'well', 'and', 'to', 'becom', 'healthi', 'and', 'happi']",this kid deserves to live and i really hope his treatment go well and to become healthy and happy,thi kid deserv to live and i realli hope hi treatment goe well and to becom healthi and happi,0,0.10833744932382122,-0.036603500876854385,0,0.4649725846146056,-0.10231371492004511,-1,0.4649725846146056,-0.10231371492004511
245,Speedy recovery,MYR,10000,15.0,2.0,"['speedy', 'recovery']","['speedy', 'recovery']","['speedi', 'recoveri']",speedy recovery,speedi recoveri,3,-0.12449112076869778,0.8581377129795612,0,-0.3111589815015091,1.0578809944858856,0,-0.3111589815015091,1.0578809944858856
247,Take care and speedy recovery little child,MYR,20000,42.0,7.0,"['take', 'care', 'and', 'speedy', 'recovery', 'little', 'child']","['take', 'care', 'and', 'speedy', 'recovery', 'little', 'child']","['take', 'care', 'and', 'speedi', 'recoveri', 'littl', 'child']",take care and speedy recovery little child,take care and speedi recoveri littl child,3,-0.10939487883773791,0.5124217769965103,0,-0.30937998959648133,1.254581209908305,0,-0.30937998959648133,1.254581209908305
249,His mother waiting he go back,SGD,3000,29.0,6.0,"['his', 'mother', 'waiting', 'he', 'go', 'back']","['his', 'mother', 'waiting', 'he', 'go', 'back']","['hi', 'mother', 'wait', 'he', 'go', 'back']",his mother waiting he go back,hi mother wait he go back,0,-0.04333475967235323,-0.028241309007690507,0,-0.06535267705766742,-0.1519550376853487,0,-0.06535267705766742,-0.1519550376853487
251,"Being retrench recently, I am aware on the fear of the unknown esp that Malaysia is still facing extended lock down... Thus, Sending love from SG & May we trust that He is  Jehovah Rapha & our provider <3",MYR,40000,204.0,40.0,"['being', 'retrench', 'recently', 'i', 'am', 'aware', 'on', 'the', 'fear', 'of', 'the', 'unknown', 'esp', 'that', 'malaysia', 'is', 'still', 'facing', 'extended', 'lock', 'down', 'thus', 'sending', 'love', 'from', 'sg', 'may', 'we', 'trust', 'that', 'he', 'is', 'jehovah', 'rapha', 'our', 'provider']","['being', 'retrench', 'recently', 'i', 'am', 'aware', 'on', 'the', 'fear', 'of', 'the', 'unknown', 'esp', 'that', 'malaysia', 'is', 'still', 'facing', 'extended', 'lock', 'down', 'thus', 'sending', 'love', 'from', 'sg', 'may', 'we', 'trust', 'that', 'he', 'is', 'jehovah', 'rapha', 'our', 'provider']","['be', 'retrench', 'recent', 'i', 'am', 'awar', 'on', 'the', 'fear', 'of', 'the', 'unknown', 'esp', 'that', 'malaysia', 'is', 'still', 'face', 'extend', 'lock', 'down', 'thu', 'send', 'love', 'from', 'sg', 'may', 'we', 'trust', 'that', 'he', 'is', 'jehovah', 'rapha', 'our', 'provid']",being retrench recently i am aware on the fear of the unknown esp that malaysia is still facing extended lock down thus sending love from sg may we trust that he is jehovah rapha our provider,be retrench recent i am awar on the fear of the unknown esp that malaysia is still face extend lock down thu send love from sg may we trust that he is jehovah rapha our provid,0,-0.08088391107108459,-0.029577025277738755,0,-0.16670065594930894,-0.050064734952825686,0,-0.16670065594930894,-0.050064734952825686
252,Charity begins with you,MYR,20000,23.0,4.0,"['charity', 'begins', 'with', 'you']","['charity', 'begin', 'with', 'you']","['chariti', 'begin', 'with', 'you']",charity begin with you,chariti begin with you,0,-0.03731340525798722,-0.01937314478888192,0,-0.11088799687211007,-0.21522336475909584,0,-0.11088799687211007,-0.21522336475909584
253,"I donated because my mom has a same situation many years back, she has insurance to support her the entire ops. Please help Auntie. I know Gleneagles Dr Ngoi. He is the surgeon whom help my mom recovered from colon cancer",SGD,10000,221.0,41.0,"['i', 'donated', 'because', 'my', 'mom', 'has', 'a', 'same', 'situation', 'many', 'years', 'back', 'she', 'has', 'insurance', 'to', 'support', 'her', 'the', 'entire', 'ops', 'please', 'help', 'auntie', 'i', 'know', 'gleneagles', 'dr', 'ngoi', 'he', 'is', 'the', 'surgeon', 'whom', 'help', 'my', 'mom', 'recovered', 'from', 'colon', 'cancer']","['i', 'donated', 'because', 'my', 'mom', 'ha', 'a', 'same', 'situation', 'many', 'year', 'back', 'she', 'ha', 'insurance', 'to', 'support', 'her', 'the', 'entire', 'ops', 'please', 'help', 'auntie', 'i', 'know', 'gleneagles', 'dr', 'ngoi', 'he', 'is', 'the', 'surgeon', 'whom', 'help', 'my', 'mom', 'recovered', 'from', 'colon', 'cancer']","['i', 'donat', 'becaus', 'my', 'mom', 'ha', 'a', 'same', 'situat', 'mani', 'year', 'back', 'she', 'ha', 'insur', 'to', 'support', 'her', 'the', 'entir', 'op', 'pleas', 'help', 'aunti', 'i', 'know', 'gleneagl', 'dr', 'ngoi', 'he', 'is', 'the', 'surgeon', 'whom', 'help', 'my', 'mom', 'recov', 'from', 'colon', 'cancer']",i donated because my mom ha a same situation many year back she ha insurance to support her the entire ops please help auntie i know gleneagles dr ngoi he is the surgeon whom help my mom recovered from colon cancer,i donat becaus my mom ha a same situat mani year back she ha insur to support her the entir op pleas help aunti i know gleneagl dr ngoi he is the surgeon whom help my mom recov from colon cancer,0,-0.052415600600941366,-0.04604591403188555,0,-0.13634667707162162,-0.16631809747552148,0,-0.13634667707162162,-0.16631809747552148
254,"nobody wants to be in this situation. we help while we can.
when someone ask for help in finances, it is more than an ask, because he/she has put down everything to ask. 
let us all try to help :)",SGD,5000,196.0,39.0,"['nobody', 'wants', 'to', 'be', 'in', 'this', 'situation', 'we', 'help', 'while', 'we', 'can', 'when', 'someone', 'ask', 'for', 'help', 'in', 'finances', 'it', 'is', 'more', 'than', 'an', 'ask', 'because', 'he', 'she', 'has', 'put', 'down', 'everything', 'to', 'ask', 'let', 'us', 'all', 'try', 'to', 'help']","['nobody', 'want', 'to', 'be', 'in', 'this', 'situation', 'we', 'help', 'while', 'we', 'can', 'when', 'someone', 'ask', 'for', 'help', 'in', 'finance', 'it', 'is', 'more', 'than', 'an', 'ask', 'because', 'he', 'she', 'ha', 'put', 'down', 'everything', 'to', 'ask', 'let', 'u', 'all', 'try', 'to', 'help']","['nobodi', 'want', 'to', 'be', 'in', 'thi', 'situat', 'we', 'help', 'while', 'we', 'can', 'when', 'someon', 'ask', 'for', 'help', 'in', 'financ', 'it', 'is', 'more', 'than', 'an', 'ask', 'becaus', 'he', 'she', 'ha', 'put', 'down', 'everyth', 'to', 'ask', 'let', 'us', 'all', 'tri', 'to', 'help']",nobody want to be in this situation we help while we can when someone ask for help in finance it is more than an ask because he she ha put down everything to ask let u all try to help,nobodi want to be in thi situat we help while we can when someon ask for help in financ it is more than an ask becaus he she ha put down everyth to ask let us all tri to help,0,-0.09133491578614884,-0.10478905213900877,0,-0.2070542523751307,-0.2645628995480916,0,-0.2070542523751307,-0.2645628995480916
255,Jiayou!hope u recover soon!,SGD,1000,27.0,4.0,"['jiayou', 'hope', 'u', 'recover', 'soon']","['jiayou', 'hope', 'u', 'recover', 'soon']","['jiayou', 'hope', 'u', 'recov', 'soon']",jiayou hope u recover soon,jiayou hope u recov soon,0,-0.0724155098100697,0.13753440679854506,0,-0.10743990099987072,-0.15481236221400432,0,-0.10743990099987072,-0.15481236221400432
256,I donated in honor of NCT Mark Lee's birthday ♡ Mark is also a Christian and I wanted to celebrate his birthday by helping out others in God's kingdom :)),USD,2300,154.0,30.0,"['i', 'donated', 'in', 'honor', 'of', 'nct', 'mark', 'lee', 's', 'birthday', 'mark', 'is', 'also', 'a', 'christian', 'and', 'i', 'wanted', 'to', 'celebrate', 'his', 'birthday', 'by', 'helping', 'out', 'others', 'in', 'god', 's', 'kingdom']","['i', 'donated', 'in', 'honor', 'of', 'nct', 'mark', 'lee', 's', 'birthday', 'mark', 'is', 'also', 'a', 'christian', 'and', 'i', 'wanted', 'to', 'celebrate', 'his', 'birthday', 'by', 'helping', 'out', 'others', 'in', 'god', 's', 'kingdom']","['i', 'donat', 'in', 'honor', 'of', 'nct', 'mark', 'lee', 's', 'birthday', 'mark', 'is', 'also', 'a', 'christian', 'and', 'i', 'want', 'to', 'celebr', 'hi', 'birthday', 'by', 'help', 'out', 'other', 'in', 'god', 's', 'kingdom']",i donated in honor of nct mark lee s birthday mark is also a christian and i wanted to celebrate his birthday by helping out others in god s kingdom,i donat in honor of nct mark lee s birthday mark is also a christian and i want to celebr hi birthday by help out other in god s kingdom,0,-0.07601691702368513,-0.04317078323863144,0,-0.19730756651754924,0.08630303358486664,0,-0.19730756651754924,0.08630303358486664
257,"I feel so much for the situation that’s happening in India from news articles, friends and videos being shared. It’s horrible and I would never want that situation to happen to anyone ever. 

As fellow humans, we need to help each other",SGD,10000,236.0,42.0,"['i', 'feel', 'so', 'much', 'for', 'the', 'situation', 'that', 's', 'happening', 'in', 'india', 'from', 'news', 'articles', 'friends', 'and', 'videos', 'being', 'shared', 'it', 's', 'horrible', 'and', 'i', 'would', 'never', 'want', 'that', 'situation', 'to', 'happen', 'to', 'anyone', 'ever', 'as', 'fellow', 'humans', 'we', 'need', 'to', 'help', 'each', 'other']","['i', 'feel', 'so', 'much', 'for', 'the', 'situation', 'that', 's', 'happening', 'in', 'india', 'from', 'news', 'article', 'friend', 'and', 'video', 'being', 'shared', 'it', 's', 'horrible', 'and', 'i', 'would', 'never', 'want', 'that', 'situation', 'to', 'happen', 'to', 'anyone', 'ever', 'a', 'fellow', 'human', 'we', 'need', 'to', 'help', 'each', 'other']","['i', 'feel', 'so', 'much', 'for', 'the', 'situat', 'that', 's', 'happen', 'in', 'india', 'from', 'news', 'articl', 'friend', 'and', 'video', 'be', 'share', 'it', 's', 'horribl', 'and', 'i', 'would', 'never', 'want', 'that', 'situat', 'to', 'happen', 'to', 'anyon', 'ever', 'as', 'fellow', 'human', 'we', 'need', 'to', 'help', 'each', 'other']",i feel so much for the situation that s happening in india from news article friend and video being shared it s horrible and i would never want that situation to happen to anyone ever a fellow human we need to help each other,i feel so much for the situat that s happen in india from news articl friend and video be share it s horribl and i would never want that situat to happen to anyon ever as fellow human we need to help each other,0,-0.09536026372629369,-0.13718686363521224,0,-0.2659988791788329,-0.352973865219387,-1,-0.2659988791788329,-0.352973865219387
258,we have to treat it as family on the earth.,INR,50000,43.0,10.0,"['we', 'have', 'to', 'treat', 'it', 'as', 'family', 'on', 'the', 'earth']","['we', 'have', 'to', 'treat', 'it', 'a', 'family', 'on', 'the', 'earth']","['we', 'have', 'to', 'treat', 'it', 'as', 'famili', 'on', 'the', 'earth']",we have to treat it a family on the earth,we have to treat it as famili on the earth,0,-0.0914336143613206,-0.021058871011158567,0,-0.1875657454524601,0.020191391756279643,0,-0.1875657454524601,0.020191391756279643
260,"I donated because he deserves to see the world and grow. As a kid, he deserve to have a wonderful childhood to remember. But with his strength and bravery, I want to believe he can pull through. Keeping you in my prayers.",SGD,5000,221.0,42.0,"['i', 'donated', 'because', 'he', 'deserves', 'to', 'see', 'the', 'world', 'and', 'grow', 'as', 'a', 'kid', 'he', 'deserve', 'to', 'have', 'a', 'wonderful', 'childhood', 'to', 'remember', 'but', 'with', 'his', 'strength', 'and', 'bravery', 'i', 'want', 'to', 'believe', 'he', 'can', 'pull', 'through', 'keeping', 'you', 'in', 'my', 'prayers']","['i', 'donated', 'because', 'he', 'deserves', 'to', 'see', 'the', 'world', 'and', 'grow', 'a', 'a', 'kid', 'he', 'deserve', 'to', 'have', 'a', 'wonderful', 'childhood', 'to', 'remember', 'but', 'with', 'his', 'strength', 'and', 'bravery', 'i', 'want', 'to', 'believe', 'he', 'can', 'pull', 'through', 'keeping', 'you', 'in', 'my', 'prayer']","['i', 'donat', 'becaus', 'he', 'deserv', 'to', 'see', 'the', 'world', 'and', 'grow', 'as', 'a', 'kid', 'he', 'deserv', 'to', 'have', 'a', 'wonder', 'childhood', 'to', 'rememb', 'but', 'with', 'hi', 'strength', 'and', 'braveri', 'i', 'want', 'to', 'believ', 'he', 'can', 'pull', 'through', 'keep', 'you', 'in', 'my', 'prayer']",i donated because he deserves to see the world and grow a a kid he deserve to have a wonderful childhood to remember but with his strength and bravery i want to believe he can pull through keeping you in my prayer,i donat becaus he deserv to see the world and grow as a kid he deserv to have a wonder childhood to rememb but with hi strength and braveri i want to believ he can pull through keep you in my prayer,0,-0.07588167747402476,-0.09056518192396312,0,-0.13259287194607772,-0.14732925653975018,-1,-0.13259287194607772,-0.14732925653975018
261,It is the right thing to do…,SGD,5000,28.0,7.0,"['it', 'is', 'the', 'right', 'thing', 'to', 'do']","['it', 'is', 'the', 'right', 'thing', 'to', 'do']","['it', 'is', 'the', 'right', 'thing', 'to', 'do']",it is the right thing to do,it is the right thing to do,0,-0.04081457686781031,-0.02893707595407702,0,-0.11361631797358386,-0.20863175204646472,0,-0.11361631797358386,-0.20863175204646472
262,I donated because I know her since high school and I am ofw as well. I hope this small amount can help here medical needs,SGD,5000,121.0,25.0,"['i', 'donated', 'because', 'i', 'know', 'her', 'since', 'high', 'school', 'and', 'i', 'am', 'ofw', 'as', 'well', 'i', 'hope', 'this', 'small', 'amount', 'can', 'help', 'here', 'medical', 'needs']","['i', 'donated', 'because', 'i', 'know', 'her', 'since', 'high', 'school', 'and', 'i', 'am', 'ofw', 'a', 'well', 'i', 'hope', 'this', 'small', 'amount', 'can', 'help', 'here', 'medical', 'need']","['i', 'donat', 'becaus', 'i', 'know', 'her', 'sinc', 'high', 'school', 'and', 'i', 'am', 'ofw', 'as', 'well', 'i', 'hope', 'thi', 'small', 'amount', 'can', 'help', 'here', 'medic', 'need']",i donated because i know her since high school and i am ofw a well i hope this small amount can help here medical need,i donat becaus i know her sinc high school and i am ofw as well i hope thi small amount can help here medic need,2,0.0877078073276596,-0.0937162554223634,0,0.3039544059403791,-0.1267555251379316,0,0.3039544059403791,-0.1267555251379316
263,In remembrance of Ying and support of CEP,SGD,10000,41.0,8.0,"['in', 'remembrance', 'of', 'ying', 'and', 'support', 'of', 'cep']","['in', 'remembrance', 'of', 'ying', 'and', 'support', 'of', 'cep']","['in', 'remembr', 'of', 'ying', 'and', 'support', 'of', 'cep']",in remembrance of ying and support of cep,in remembr of ying and support of cep,0,-0.07877406179764142,-0.06587811939613042,0,-0.1541095832726142,-0.22478205449325178,0,-0.1541095832726142,-0.22478205449325178
264,"TBSS has a sister company in Vietnam, Cong Ty TNHH Cong Nghe va giam Sat Radar TBSS.  Our director who stations in HCMC has been there for years, he is now fighting with the people against the pandemic.",VND,5000000,202.0,39.0,"['tbss', 'has', 'a', 'sister', 'company', 'in', 'vietnam', 'cong', 'ty', 'tnhh', 'cong', 'nghe', 'va', 'giam', 'sat', 'radar', 'tbss', 'our', 'director', 'who', 'stations', 'in', 'hcmc', 'has', 'been', 'there', 'for', 'years', 'he', 'is', 'now', 'fighting', 'with', 'the', 'people', 'against', 'the', 'pandemic']","['tb', 'ha', 'a', 'sister', 'company', 'in', 'vietnam', 'cong', 'ty', 'tnhh', 'cong', 'nghe', 'va', 'giam', 'sat', 'radar', 'tb', 'our', 'director', 'who', 'station', 'in', 'hcmc', 'ha', 'been', 'there', 'for', 'year', 'he', 'is', 'now', 'fighting', 'with', 'the', 'people', 'against', 'the', 'pandemic']","['tbss', 'ha', 'a', 'sister', 'compani', 'in', 'vietnam', 'cong', 'ty', 'tnhh', 'cong', 'nghe', 'va', 'giam', 'sat', 'radar', 'tbss', 'our', 'director', 'who', 'station', 'in', 'hcmc', 'ha', 'been', 'there', 'for', 'year', 'he', 'is', 'now', 'fight', 'with', 'the', 'peopl', 'against', 'the', 'pandem']",tb ha a sister company in vietnam cong ty tnhh cong nghe va giam sat radar tb our director who station in hcmc ha been there for year he is now fighting with the people against the pandemic,tbss ha a sister compani in vietnam cong ty tnhh cong nghe va giam sat radar tbss our director who station in hcmc ha been there for year he is now fight with the peopl against the pandem,2,-0.06271890514595763,-0.0881108687778776,0,-0.15635755806909016,-0.2683998977000202,0,-0.15635755806909016,-0.2683998977000202
265,I received it from my friend..,SGD,5000,30.0,6.0,"['i', 'received', 'it', 'from', 'my', 'friend']","['i', 'received', 'it', 'from', 'my', 'friend']","['i', 'receiv', 'it', 'from', 'my', 'friend']",i received it from my friend,i receiv it from my friend,0,-0.04219481353518369,-0.022802627901244574,0,-0.1154122762639087,-0.21481693361591445,0,-0.1154122762639087,-0.21481693361591445
266,Small amount but we hope it helpa,SGD,2000,33.0,7.0,"['small', 'amount', 'but', 'we', 'hope', 'it', 'helpa']","['small', 'amount', 'but', 'we', 'hope', 'it', 'helpa']","['small', 'amount', 'but', 'we', 'hope', 'it', 'helpa']",small amount but we hope it helpa,small amount but we hope it helpa,0,-0.062034150012302704,-0.03441858020151835,0,-0.16803160345376622,-0.18801845422441707,0,-0.16803160345376622,-0.18801845422441707
267,"To kids family members, remember to take care of yourselves in order to show up better for you and your kid. Have faith and stay strong 💪 you can do this!",SGD,5000,154.0,31.0,"['to', 'kids', 'family', 'members', 'remember', 'to', 'take', 'care', 'of', 'yourselves', 'in', 'order', 'to', 'show', 'up', 'better', 'for', 'you', 'and', 'your', 'kid', 'have', 'faith', 'and', 'stay', 'strong', 'you', 'can', 'do', 'this']","['to', 'kid', 'family', 'member', 'remember', 'to', 'take', 'care', 'of', 'yourselves', 'in', 'order', 'to', 'show', 'up', 'better', 'for', 'you', 'and', 'your', 'kid', 'have', 'faith', 'and', 'stay', 'strong', 'you', 'can', 'do', 'this']","['to', 'kid', 'famili', 'member', 'rememb', 'to', 'take', 'care', 'of', 'yourselv', 'in', 'order', 'to', 'show', 'up', 'better', 'for', 'you', 'and', 'your', 'kid', 'have', 'faith', 'and', 'stay', 'strong', 'you', 'can', 'do', 'thi']",to kid family member remember to take care of yourselves in order to show up better for you and your kid have faith and stay strong you can do this,to kid famili member rememb to take care of yourselv in order to show up better for you and your kid have faith and stay strong you can do thi,0,-0.03177317416191773,-0.021353362101789883,0,0.18524878639197573,0.3335115925943763,-1,0.18524878639197573,0.3335115925943763
268,I donated because Jocelin’s so young and deserved to recover and to continue her life in this world. Similar transplant was advised to my dad and totally understood the pain to be endured by the kid. Please support her!,MYR,40000,219.0,39.0,"['i', 'donated', 'because', 'jocelin', 's', 'so', 'young', 'and', 'deserved', 'to', 'recover', 'and', 'to', 'continue', 'her', 'life', 'in', 'this', 'world', 'similar', 'transplant', 'was', 'advised', 'to', 'my', 'dad', 'and', 'totally', 'understood', 'the', 'pain', 'to', 'be', 'endured', 'by', 'the', 'kid', 'please', 'support', 'her']","['i', 'donated', 'because', 'jocelin', 's', 'so', 'young', 'and', 'deserved', 'to', 'recover', 'and', 'to', 'continue', 'her', 'life', 'in', 'this', 'world', 'similar', 'transplant', 'wa', 'advised', 'to', 'my', 'dad', 'and', 'totally', 'understood', 'the', 'pain', 'to', 'be', 'endured', 'by', 'the', 'kid', 'please', 'support', 'her']","['i', 'donat', 'becaus', 'jocelin', 's', 'so', 'young', 'and', 'deserv', 'to', 'recov', 'and', 'to', 'continu', 'her', 'life', 'in', 'thi', 'world', 'similar', 'transplant', 'wa', 'advis', 'to', 'my', 'dad', 'and', 'total', 'understood', 'the', 'pain', 'to', 'be', 'endur', 'by', 'the', 'kid', 'pleas', 'support', 'her']",i donated because jocelin s so young and deserved to recover and to continue her life in this world similar transplant wa advised to my dad and totally understood the pain to be endured by the kid please support her,i donat becaus jocelin s so young and deserv to recov and to continu her life in thi world similar transplant wa advis to my dad and total understood the pain to be endur by the kid pleas support her,0,-0.06896981578403727,-0.024540702482032294,0,-0.14853331641499062,-0.18190454292922953,-1,-0.14853331641499062,-0.18190454292922953
269,"Although a small amount. I hope he is able to recover with a peace of mind, without worrying about the finances.",SGD,1000,112.0,21.0,"['although', 'a', 'small', 'amount', 'i', 'hope', 'he', 'is', 'able', 'to', 'recover', 'with', 'a', 'peace', 'of', 'mind', 'without', 'worrying', 'about', 'the', 'finances']","['although', 'a', 'small', 'amount', 'i', 'hope', 'he', 'is', 'able', 'to', 'recover', 'with', 'a', 'peace', 'of', 'mind', 'without', 'worrying', 'about', 'the', 'finance']","['although', 'a', 'small', 'amount', 'i', 'hope', 'he', 'is', 'abl', 'to', 'recov', 'with', 'a', 'peac', 'of', 'mind', 'without', 'worri', 'about', 'the', 'financ']",although a small amount i hope he is able to recover with a peace of mind without worrying about the finance,although a small amount i hope he is abl to recov with a peac of mind without worri about the financ,0,-0.07680569521557895,0.02915645307998638,0,-0.1785928541955646,-0.11464347667174636,0,-0.1785928541955646,-0.11464347667174636
270,We care…,SGD,100000,8.0,2.0,"['we', 'care']","['we', 'care']","['we', 'care']",we care,we care,0,-0.056285736426676336,-0.016075780473231965,0,-0.11482108422760981,-0.1868135052035774,0,-0.11482108422760981,-0.1868135052035774
271,Jiayou!Theres lots of love in this world,SGD,2000,40.0,7.0,"['jiayou', 'theres', 'lots', 'of', 'love', 'in', 'this', 'world']","['jiayou', 'there', 'lot', 'of', 'love', 'in', 'this', 'world']","['jiayou', 'there', 'lot', 'of', 'love', 'in', 'thi', 'world']",jiayou there lot of love in this world,jiayou there lot of love in thi world,0,-0.08054306058204108,-0.0651632280926715,0,-0.1519206010671288,-0.24161214959766136,0,-0.1519206010671288,-0.24161214959766136
272,All is well,SGD,5000,11.0,3.0,"['all', 'is', 'well']","['all', 'is', 'well']","['all', 'is', 'well']",all is well,all is well,1,0.5385617668380569,0.002139727798684182,0,0.41462215641269046,-0.1613941229133634,0,0.41462215641269046,-0.1613941229133634
273,If I draw near to God and the love of Jesus. Jesus will set us free,SGD,500,67.0,16.0,"['if', 'i', 'draw', 'near', 'to', 'god', 'and', 'the', 'love', 'of', 'jesus', 'jesus', 'will', 'set', 'us', 'free']","['if', 'i', 'draw', 'near', 'to', 'god', 'and', 'the', 'love', 'of', 'jesus', 'jesus', 'will', 'set', 'u', 'free']","['if', 'i', 'draw', 'near', 'to', 'god', 'and', 'the', 'love', 'of', 'jesu', 'jesu', 'will', 'set', 'us', 'free']",if i draw near to god and the love of jesus jesus will set u free,if i draw near to god and the love of jesu jesu will set us free,0,-0.06416298655359366,-0.016061417162718604,0,-0.20117991554559506,0.1357232929116952,0,-0.20117991554559506,0.1357232929116952
274,I'm also a chef. 加油,SGD,5000,19.0,5.0,"['i', 'm', 'also', 'a', 'chef']","['i', 'm', 'also', 'a', 'chef']","['i', 'm', 'also', 'a', 'chef']",i m also a chef,i m also a chef,0,-0.04262400480896732,-0.022414530014529945,0,-0.10493554427299964,-0.19513833714466963,0,-0.10493554427299964,-0.19513833714466963
